keyword,intent,funnel,geo,cluster,target_page,difficulty,priority,serp_features
sciatica exercises for office workers,Informational,TOFU,NONE,sciatica-exercises,NEW,Low,85,Video
back pain due to sitting hyderabad,Informational,TOFU,HYD,sciatica-exercises,NEW,Low,80,Snippet
endoscopic spine surgery recovery time,Informational,MOFU,NONE,recovery-timeline,/blog/endoscopic-spine-surgery-recovery-timeline,Med,90,Snippet
return to work after spine surgery,Informational,MOFU,NONE,recovery-timeline,/blog/endoscopic-spine-surgery-recovery-timeline,Med,75,PAA
best spine surgeon for sciatica hyderabad,Commercial,BOFU,HYD,sciatica-treatment,/conditions/sciatica-pain-treatment-hyderabad,High,95,Local Pack
lumbar spondylosis exercises at home,Informational,TOFU,NONE,sciatica-exercises,NEW,Low,70,Video
spine surgery cost hyderabad for cash patients,Commercial,BOFU,HYD,cost,/services/spine-surgery-cost-hyderabad,High,60,Ads
endoscopic discectomy vs microdiscectomy recovery,Commercial,MOFU,NONE,recovery-timeline,/blog/endoscopic-spine-surgery-recovery-timeline,Med,65,Table
