keyword,intent,funnel,geo,cluster_label,recommended_target,difficulty,priority,serp_notes,needs_manual_validation
endoscopic spine surgery hyderabad,Commercial,BOFU,HYD,HYD | BOFU | SPINE | endoscopic-discectomy | service,/services/endoscopic-spine-surgery-hyderabad,High,90,Local Pack + Ads,FALSE
uniportal endoscopic spine surgery hyderabad,Commercial,BOFU,HYD,HYD | BOFU | SPINE | endoscopic-discectomy | niche,/services/uniportal-endoscopic-spine-surgery-hyderabad,Med,85,Niche differentiator,FALSE
single hole spine surgery hyderabad,Commercial,BOFU,HYD,HYD | BOFU | SPINE | endoscopic-discectomy | layman,/services/uniportal-endoscopic-spine-surgery-hyderabad,Low,75,,FALSE
stitchless spine surgery hyderabad,Commercial,BOFU,HYD,HYD | BOFU | SPINE | endoscopic-discectomy | benefit,/services/uniportal-endoscopic-spine-surgery-hyderabad,Med,80,Used by competitors,FALSE
best endoscopic spine surgeon in hyderabad,Commercial,BOFU,HYD,HYD | BOFU | SPINE | endoscopic-discectomy | best-doctor,/,High,95,Crowded SERP,FALSE
endoscopic discectomy cost hyderabad,Commercial,BOFU,HYD,HYD | BOFU | SPINE | endoscopic-discectomy | cost,/services/endoscopic-spine-surgery-hyderabad,High,85,Price snippets visible,FALSE
endoscopic spine surgery vs microdiscectomy,Informational,MOFU,NONE,NONE | MOFU | SPINE | comparison | tech,/blog/microdiscectomy-vs-laminectomy-recovery-comparison,Med,60,,FALSE
laser spine surgery hyderabad,Commercial,BOFU,HYD,HYD | BOFU | SPINE | laser | service,/services/minimally-invasive-spine-surgery,High,70,Often conflated with endoscopic,FALSE
