URL,Status,Title,Meta Description,H1,Word Count,Canonical,Robots,Schema Types
https://www.drsayuj.info/locations/neurosurgeon-near-jubilee-hills-faq,200,Neurosurgeon Near Jubilee Hills FAQ | Dr. Sayuj Krishnan,"Frequently asked questions about finding a neurosurgeon near Jubilee Hills, Hyderabad. Expert answers from Dr. Sayuj Krishnan about brain and spine surgery options.",Neurosurgeon Near Jubilee Hills FAQ | Dr. Sayuj Krishnan,1052,https://www.drsayuj.info/locations/neurosurgeon-near-jubilee-hills-faq,"index, follow",Place;FAQPage;CollegeOrUniversity;OpeningHoursSpecification;AggregateRating;MedicalSpecialty;State;BreadcrumbList;Hospital;ReserveAction;Offer;WebSite;MedicalService;Physician;PropertyValue;Question;GeoCoordinates;Organization;City;Answer;PostalAddress;MedicalClinic;OfferCatalog;ListItem;EducationalOccupationalCredential;MedicalProcedure;Country
https://www.drsayuj.info/knowledge-base,200,Medical Knowledge Base - Dr. Sayuj Krishnan,"Search our comprehensive medical library for information on brain tumors, spine surgery, treatments, and recovery guides.",Medical Knowledge Base,459,https://www.drsayuj.info/knowledge-base,"index, follow",Place;CollegeOrUniversity;OpeningHoursSpecification;AggregateRating;MedicalSpecialty;State;BreadcrumbList;Hospital;ReserveAction;Offer;WebSite;MedicalService;Physician;PropertyValue;GeoCoordinates;Organization;City;PostalAddress;OfferCatalog;ListItem;EducationalOccupationalCredential;MedicalProcedure;Country
https://www.drsayuj.info/blog/degenerative-disc-disease-guide-hyderabad,200,What is Degenerative Disc Disease? Understanding 'Black Dis…,"Learn about Degenerative Disc Disease (DDD), symptoms of black disc, and treatment options in Hyderabad. Understand when surgery is needed.",What is Degenerative Disc Disease? Understanding 'Black Disc' and Spine Aging,1828,https://www.drsayuj.info/blog/degenerative-disc-disease-guide-hyderabad,"index, follow",Place;FAQPage;CollegeOrUniversity;OpeningHoursSpecification;AggregateRating;MedicalSpecialty;State;BreadcrumbList;Hospital;ReserveAction;Offer;MedicalWebPage;WebSite;MedicalService;Physician;PropertyValue;Question;GeoCoordinates;Organization;City;Answer;PostalAddress;OfferCatalog;ListItem;EducationalOccupationalCredential;MedicalProcedure;Person;Country
https://www.drsayuj.info/locations/neurosurgeon-kondapur,200,"Neurosurgeon near Kondapur, Hyderabad | Dr Sayuj Krishnan",Expert neurosurgeon near Kondapur. Dr Sayuj Krishnan provides advanced brain and spine surgery. Convenient access via Hitech City road.,"Neurosurgeon Near Kondapur, Hyderabad",575,https://www.drsayuj.info/locations/neurosurgeon-kondapur,"index, follow",Place;FAQPage;CollegeOrUniversity;OpeningHoursSpecification;AggregateRating;MedicalSpecialty;State;BreadcrumbList;Hospital;ReserveAction;Offer;WebSite;MedicalService;Physician;PropertyValue;Question;GeoCoordinates;Organization;City;Answer;PostalAddress;MedicalClinic;OfferCatalog;ListItem;EducationalOccupationalCredential;MedicalProcedure;Country
https://www.drsayuj.info/blog/awake-craniotomy-brain-tumor-guide,200,Awake Craniotomy: Why and How Brain Surgery Is Performed Wh…,Dr. Sayuj Krishnan explains Awake Craniotomy: a technique for removing brain tumors near critical areas while preserving speech and motor function.,Awake Craniotomy: Why and How Brain Surgery Is Performed While You Are Awake,1900,https://www.drsayuj.info/blog/awake-craniotomy-brain-tumor-guide,"index, follow",Place;FAQPage;CollegeOrUniversity;OpeningHoursSpecification;AggregateRating;MedicalSpecialty;State;BreadcrumbList;Hospital;ReserveAction;Offer;MedicalWebPage;WebSite;MedicalService;Physician;PropertyValue;Question;GeoCoordinates;Organization;City;Answer;PostalAddress;OfferCatalog;ListItem;EducationalOccupationalCredential;MedicalProcedure;Person;Country
https://www.drsayuj.info/conditions/brain-tumor-surgery-hyderabad,200,Brain Tumor Symptoms Hyderabad | Diagnosis & Treatment,"Comprehensive guide to brain tumor symptoms, diagnosis, and care options. Learn about warning signs and expert diagnosis in Hyderabad.",Brain Tumor Symptoms & Diagnosis in Hyderabad,1049,https://www.drsayuj.info/conditions/brain-tumor-symptoms-hyderabad,"index, follow",Place;FAQPage;MedicalCondition;CollegeOrUniversity;OpeningHoursSpecification;AggregateRating;MedicalSpecialty;State;BreadcrumbList;Hospital;ReserveAction;Offer;MedicalWebPage;WebSite;MedicalService;Physician;PropertyValue;Question;GeoCoordinates;Organization;City;Answer;PostalAddress;OfferCatalog;ListItem;EducationalOccupationalCredential;MedicalProcedure;Country
https://www.drsayuj.info/blog/understanding-brain-mri-tumor-report-guide,200,Understanding Your Brain MRI Report: Benign vs. Malignant T…,"Decode your brain MRI report. Understand terms like mass effect, enhancing lesion, and edema, and learn the signs of benign vs malignant tumors.",Understanding Your Brain MRI Report: Benign vs. Malignant Tumor Signs,1594,https://www.drsayuj.info/blog/understanding-brain-mri-tumor-report-guide,"index, follow",Place;FAQPage;CollegeOrUniversity;OpeningHoursSpecification;AggregateRating;MedicalSpecialty;State;BreadcrumbList;Hospital;ReserveAction;Offer;MedicalWebPage;WebSite;MedicalService;Physician;PropertyValue;Question;GeoCoordinates;Organization;City;Answer;PostalAddress;OfferCatalog;ListItem;EducationalOccupationalCredential;MedicalProcedure;Person;Country
https://www.drsayuj.info/services/slip-disc-surgery-cost-hyderabad,200,Slip Disc Surgery Cost in Hyderabad | Endoscopic Discectomy…,"Complete guide to slip disc (herniated disc) surgery cost in Hyderabad. Endoscopic discectomy prices, insurance coverage, and payment options at Yashoda H…",Slip Disc Surgery Cost in Hyderabad,736,https://www.drsayuj.info/services/slip-disc-surgery-cost-hyderabad,"index, follow",Place;FAQPage;CollegeOrUniversity;OpeningHoursSpecification;AggregateRating;MedicalSpecialty;State;BreadcrumbList;Hospital;ReserveAction;Offer;WebSite;MedicalService;Physician;PropertyValue;Question;GeoCoordinates;Organization;City;Answer;PostalAddress;OfferCatalog;ListItem;EducationalOccupationalCredential;MedicalProcedure;Country
https://www.drsayuj.info/neurosurgeon-banjara-hills,200,Neurosurgeon in Banjara Hills | Endoscopic Spine | Dr. Sayuj,"Consult Dr. Sayuj Krishnan near Banjara Hills, Hyderabad for endoscopic spine & minimally invasive brain surgery. OPD timings, parking, directions, WhatsApp booking, and FAQs.","Neurosurgeon in Banjara Hills, Hyderabad",575,https://www.drsayuj.info/neurosurgeon-banjara-hills,"index, follow",Place;FAQPage;CollegeOrUniversity;OpeningHoursSpecification;AggregateRating;MedicalSpecialty;State;BreadcrumbList;Hospital;ReserveAction;Offer;MedicalWebPage;WebSite;MedicalAudience;MedicalService;Physician;PropertyValue;Question;GeoCoordinates;Organization;City;Answer;PostalAddress;Audience;MedicalClinic;OfferCatalog;ListItem;EducationalOccupationalCredential;MedicalProcedure;Person;Country
https://www.drsayuj.info/cookies,200,Cookie Policy | Dr Sayuj Krishnan - Neurosurgeon in Hyderabad,Cookie policy for Dr Sayuj Krishnan's neurosurgical practice website. Learn about how we use cookies and similar technologies.,Cookie Policy,577,https://www.drsayuj.info/cookies,"index, follow",Place;CollegeOrUniversity;OpeningHoursSpecification;AggregateRating;MedicalSpecialty;State;BreadcrumbList;Hospital;ReserveAction;Offer;WebSite;MedicalService;Physician;PropertyValue;GeoCoordinates;Organization;City;PostalAddress;OfferCatalog;ListItem;EducationalOccupationalCredential;MedicalProcedure;Country
https://www.drsayuj.info/services/endoscopic-discectomy-hyderabad,200,Endoscopic Discectomy Hyderabad,"Expert endoscopic discectomy for herniated discs in Hyderabad. Same-day surgery, faster recovery, less pain with Dr. Sayuj Krishnan.",Endoscopic Discectomy in Hyderabad,1017,https://www.drsayuj.info/services/endoscopic-discectomy-hyderabad,"index, follow",Place;FAQPage;CollegeOrUniversity;OpeningHoursSpecification;AggregateRating;MedicalSpecialty;State;Hospital;ReserveAction;Offer;MedicalWebPage;WebSite;MedicalAudience;MedicalService;Physician;PropertyValue;Question;GeoCoordinates;Organization;City;Answer;PostalAddress;OfferCatalog;EducationalOccupationalCredential;MedicalProcedure;Person;Country
https://www.drsayuj.info/blog/driving-after-spine-surgery-safety-guide,200,Driving After Spine Surgery: When Is It Safe? (Hyderabad Gu…,"A neurosurgeon's guide to driving after spine surgery in Hyderabad. Learn the timelines for endoscopic surgery vs fusion, and when it's safe to ride a bik…",Driving After Spine Surgery: When Is It Safe? (Hyderabad Guide),1609,https://www.drsayuj.info/blog/driving-after-spine-surgery-safety-guide,"index, follow",Place;FAQPage;CollegeOrUniversity;OpeningHoursSpecification;AggregateRating;MedicalSpecialty;State;BreadcrumbList;Hospital;ReserveAction;Offer;MedicalWebPage;WebSite;MedicalService;Physician;PropertyValue;Question;GeoCoordinates;Organization;City;Answer;PostalAddress;OfferCatalog;ListItem;EducationalOccupationalCredential;MedicalProcedure;Person;Country
https://www.drsayuj.info/privacy,200,Privacy Policy | Dr Sayuj Krishnan - Neurosurgeon in Hyderabad,Privacy policy for Dr Sayuj Krishnan's neurosurgical practice in Hyderabad. Learn how we protect your personal and medical information.,Privacy Policy,690,https://www.drsayuj.info/privacy,"index, follow",Place;CollegeOrUniversity;OpeningHoursSpecification;AggregateRating;MedicalSpecialty;State;BreadcrumbList;Hospital;ReserveAction;Offer;WebSite;MedicalService;Physician;PropertyValue;GeoCoordinates;Organization;City;PostalAddress;OfferCatalog;ListItem;EducationalOccupationalCredential;MedicalProcedure;Country
https://www.drsayuj.info/services/kyphoplasty-vertebroplasty-hyderabad,200,Vertebroplasty & Kyphoplasty Hyderabad | Fracture Treatment,Expert Vertebroplasty & Kyphoplasty in Hyderabad. Instant pain relief for Osteoporotic Spine Fractures. Minimally Invasive Cement Injection by Dr Sayuj.,Vertebroplasty & Kyphoplasty in Hyderabad,1266,https://www.drsayuj.info/services/kyphoplasty-vertebroplasty-hyderabad,"index, follow",Place;FAQPage;CollegeOrUniversity;OpeningHoursSpecification;AggregateRating;MedicalSpecialty;State;BreadcrumbList;Hospital;ReserveAction;Offer;WebSite;MedicalService;Physician;PropertyValue;Question;GeoCoordinates;Organization;City;Answer;PostalAddress;OfferCatalog;ListItem;EducationalOccupationalCredential;MedicalProcedure;Country
https://www.drsayuj.info/blog/sciatica-exercises-to-avoid-hyderabad,200,5 Exercises to Avoid with Sciatica: Don't Make It Worse | D…,"Expert guide on exercises to avoid with sciatica. Learn why hamstring stretches, deadlifts, and sit-ups can worsen nerve pain and what safe alternatives e…",5 Exercises to Avoid with Sciatica: Don't Make It Worse,1278,https://www.drsayuj.info/blog/sciatica-exercises-to-avoid-hyderabad,"index, follow",Place;FAQPage;CollegeOrUniversity;OpeningHoursSpecification;AggregateRating;MedicalSpecialty;State;BreadcrumbList;Hospital;ReserveAction;Offer;MedicalWebPage;WebSite;MedicalService;Physician;PropertyValue;Question;GeoCoordinates;Organization;City;Answer;PostalAddress;OfferCatalog;ListItem;EducationalOccupationalCredential;MedicalProcedure;Person;Country
https://www.drsayuj.info/blog/is-spine-surgery-safe-risks-success-rates-hyderabad,200,Is Spine Surgery Safe? Understanding Risks and Success Rate…,"Is spine surgery safe? Explore the truth about paralysis risks, success rates (90%+), and how modern endoscopic techniques in Hyderabad have changed the g…",Is Spine Surgery Safe? Understanding Risks and Success Rates in Hyderabad,2122,https://www.drsayuj.info/blog/is-spine-surgery-safe-risks-success-rates-hyderabad,"index, follow",Place;FAQPage;CollegeOrUniversity;OpeningHoursSpecification;AggregateRating;MedicalSpecialty;State;BreadcrumbList;Hospital;ReserveAction;Offer;MedicalWebPage;WebSite;MedicalService;Physician;PropertyValue;Question;GeoCoordinates;Organization;City;Answer;PostalAddress;OfferCatalog;ListItem;EducationalOccupationalCredential;MedicalProcedure;Person;Country
https://www.drsayuj.info/conditions/trigeminal-neuralgia-treatment-hyderabad,200,Trigeminal Neuralgia Treatment Hyderabad | Immediate Pain Relief,Expert Trigeminal Neuralgia treatment in Hyderabad. MVD surgery & Radiofrequency ablation for facial pain relief by Dr. Sayuj. Proven results. Book now.,Trigeminal Neuralgia Treatment in Hyderabad,1288,https://www.drsayuj.info/conditions/trigeminal-neuralgia-treatment-hyderabad,"index, follow",Place;FAQPage;MedicalCondition;CollegeOrUniversity;OpeningHoursSpecification;AggregateRating;MedicalSpecialty;State;Hospital;ReserveAction;Offer;MedicalWebPage;WebSite;MedicalAudience;MedicalService;Physician;PropertyValue;Question;GeoCoordinates;Organization;City;Answer;PostalAddress;OfferCatalog;EducationalOccupationalCredential;MedicalProcedure;Person;Country;MedicalTherapy
https://www.drsayuj.info/blog/head-injury-concussion-warning-signs-hyderabad,200,Head Injury & Concussion: Warning Signs and When to Seek Ca…,"Dr. Sayuj Krishnan explains head injury red flags: recognizing concussion symptoms, the lucid interval, and when to see a neurosurgeon in Hyderabad.",Head Injury & Concussion: Warning Signs and When to Seek Care,2240,https://www.drsayuj.info/blog/head-injury-concussion-warning-signs-hyderabad,"index, follow",Place;FAQPage;CollegeOrUniversity;OpeningHoursSpecification;AggregateRating;MedicalSpecialty;State;BreadcrumbList;Hospital;ReserveAction;Offer;MedicalWebPage;WebSite;MedicalService;Physician;PropertyValue;Question;GeoCoordinates;Organization;City;Answer;PostalAddress;OfferCatalog;ListItem;EducationalOccupationalCredential;MedicalProcedure;Person;Country
https://www.drsayuj.info/services/peripheral-nerve-surgery-hyderabad,200,Peripheral Nerve Surgery in Hyderabad | Carpal Tunnel Expert,"Expert peripheral nerve surgery in Hyderabad. Minimally invasive treatment for Carpal Tunnel, Ulnar Nerve, and nerve tumors. Restore sensation & strength.",Peripheral Nerve Surgery in Hyderabad,1527,https://www.drsayuj.info/services/peripheral-nerve-surgery-hyderabad,"index, follow",Place;FAQPage;CollegeOrUniversity;OpeningHoursSpecification;AggregateRating;MedicalSpecialty;State;Hospital;ReserveAction;Offer;MedicalWebPage;WebSite;MedicalAudience;MedicalService;Physician;PropertyValue;Question;GeoCoordinates;Organization;City;Answer;PostalAddress;OfferCatalog;EducationalOccupationalCredential;MedicalProcedure;Person;Country
https://www.drsayuj.info/blog/brain-aneurysm-vs-migraine-warning-signs-hyderabad,200,Brain Aneurysm vs. Migraine: When a Headache is an Emergenc…,Worst headache of your life? It might be a brain aneurysm. Learn the difference between migraine and aneurysm symptoms and when to seek emergency care.,Brain Aneurysm vs. Migraine: When a Headache is an Emergency,1511,https://www.drsayuj.info/blog/brain-aneurysm-vs-migraine-warning-signs-hyderabad,"index, follow",Place;FAQPage;CollegeOrUniversity;OpeningHoursSpecification;AggregateRating;MedicalSpecialty;State;BreadcrumbList;Hospital;ReserveAction;Offer;MedicalWebPage;WebSite;MedicalService;Physician;PropertyValue;Question;GeoCoordinates;Organization;City;Answer;PostalAddress;OfferCatalog;ListItem;EducationalOccupationalCredential;MedicalProcedure;Person;Country
https://www.drsayuj.info/neurosurgeon-secunderabad,200,"Neurosurgeon in Secunderabad, Hyderabad | Endoscopic Spine | Dr. Sayuj Krishnan","Consult Dr. Sayuj Krishnan near Secunderabad, Hyderabad for endoscopic spine & minimally invasive brain surgery. OPD timings, parking, directions, WhatsApp booking, and FAQs.","Neurosurgeon in Secunderabad, Hyderabad",548,https://www.drsayuj.info/neurosurgeon-secunderabad,"index, follow",Place;FAQPage;CollegeOrUniversity;OpeningHoursSpecification;AggregateRating;MedicalSpecialty;State;BreadcrumbList;Hospital;ReserveAction;Offer;WebSite;MedicalService;Physician;PropertyValue;Question;GeoCoordinates;Organization;City;Answer;PostalAddress;MedicalClinic;OfferCatalog;ListItem;EducationalOccupationalCredential;MedicalProcedure;Country
https://www.drsayuj.info/blog/tailbone-pain-coccydynia-treatment-hyderabad,200,"Tailbone Pain (Coccydynia) Treatment in Hyderabad: Causes,…","Comprehensive guide to Tailbone Pain (Coccydynia) in Hyderabad. Learn causes, sitting tips, and when to consult a spine specialist for relief.","Tailbone Pain (Coccydynia) Treatment in Hyderabad: Causes, Relief & When to See a Doctor",1957,https://www.drsayuj.info/blog/tailbone-pain-coccydynia-treatment-hyderabad,"index, follow",Place;FAQPage;CollegeOrUniversity;OpeningHoursSpecification;AggregateRating;MedicalSpecialty;State;BreadcrumbList;Hospital;ReserveAction;Offer;MedicalWebPage;WebSite;MedicalService;Physician;PropertyValue;Question;GeoCoordinates;Organization;City;Answer;PostalAddress;OfferCatalog;ListItem;EducationalOccupationalCredential;MedicalProcedure;Person;Country
https://www.drsayuj.info/locations/neurosurgeon-near-kondapur-faq,200,Neurosurgeon Near Kondapur FAQ | Dr. Sayuj Krishnan,"Frequently asked questions about finding a neurosurgeon near Kondapur, Hyderabad. Expert answers from Dr. Sayuj Krishnan about brain and spine surgery options.",Neurosurgeon Near Kondapur FAQ | Dr. Sayuj Krishnan,953,https://www.drsayuj.info/locations/neurosurgeon-near-kondapur-faq,"index, follow",Place;FAQPage;CollegeOrUniversity;OpeningHoursSpecification;AggregateRating;MedicalSpecialty;State;BreadcrumbList;Hospital;ReserveAction;Offer;WebSite;MedicalService;Physician;PropertyValue;Question;GeoCoordinates;Organization;City;Answer;PostalAddress;MedicalClinic;OfferCatalog;ListItem;EducationalOccupationalCredential;MedicalProcedure;Country
https://www.drsayuj.info/blog/spine-surgery-insurance-coverage-hyderabad,200,Is Spine Surgery Covered by Insurance in Hyderabad? (Cashle…,"Complete guide to spine surgery insurance coverage in Hyderabad. Check if your Mediclaim, Star Health, or corporate insurance covers endoscopic spine surg…",Is Spine Surgery Covered by Insurance in Hyderabad? (Cashless Guide),1105,https://www.drsayuj.info/blog/spine-surgery-insurance-coverage-hyderabad,"index, follow",Place;FAQPage;CollegeOrUniversity;OpeningHoursSpecification;AggregateRating;MedicalSpecialty;State;BreadcrumbList;Hospital;ReserveAction;Offer;MedicalWebPage;WebSite;MedicalService;Physician;PropertyValue;Question;GeoCoordinates;Organization;City;Answer;PostalAddress;OfferCatalog;ListItem;EducationalOccupationalCredential;MedicalProcedure;Person;Country
https://www.drsayuj.info/patient-stories,200,Patient Success Stories | Neurosurgery & Spine Surgery Hyderabad,Real patient stories of successful neurosurgery and spine surgery outcomes at Yashoda Hospital Malakpet with Dr. Sayuj Krishnan.,Patient Success Stories,846,https://www.drsayuj.info/patient-stories,"index, follow",Place;WatchAction;ImageObject;CollegeOrUniversity;OpeningHoursSpecification;AggregateRating;MedicalSpecialty;State;BreadcrumbList;Hospital;ReserveAction;Offer;VideoObject;WebSite;MedicalService;Physician;PropertyValue;GeoCoordinates;Organization;City;PostalAddress;OfferCatalog;ListItem;EducationalOccupationalCredential;MedicalProcedure;Country
https://www.drsayuj.info/contact,200,Contact Dr Sayuj Krishnan | Neurosurgeon in Hyderabad,"Contact Dr Sayuj Krishnan for neurosurgical consultations. Phone: +91 9778280044, Email: hellodr@drsayuj.info. Located at Yashoda Hospital, Malakpet.",Contact Dr Sayuj Krishnan,863,https://www.drsayuj.info/contact,"index, follow",Place;CollegeOrUniversity;OpeningHoursSpecification;AggregateRating;MedicalSpecialty;State;BreadcrumbList;Hospital;ReserveAction;Offer;MedicalWebPage;WebSite;MedicalAudience;MedicalService;Physician;PropertyValue;GeoCoordinates;Organization;City;PostalAddress;MedicalClinic;OfferCatalog;ListItem;EducationalOccupationalCredential;MedicalProcedure;Person;Country
https://www.drsayuj.info/about#credentials,200,Best Neurosurgeon Hyderabad | Dr. Sayuj Krishnan,Dr. Sayuj Krishnan is a German-trained Neurosurgeon in Hyderabad with 9+ Years of experience. Specialist in Endoscopic Spine & Brain Surgery. Read Profile.,About Dr. Sayuj Krishnan,1267,https://www.drsayuj.info/about,"index, follow",Place;CollegeOrUniversity;OpeningHoursSpecification;AggregateRating;MedicalSpecialty;State;BreadcrumbList;Hospital;ReserveAction;Offer;MedicalWebPage;WebSite;MedicalAudience;MedicalService;Physician;PropertyValue;GeoCoordinates;Organization;City;PostalAddress;OfferCatalog;ListItem;EducationalOccupationalCredential;MedicalProcedure;Person;Country
https://www.drsayuj.info/german-training,200,German Training in Endoscopic Spine Surgery | Dr. Sayuj Krishnan | International Credentials,"Dr. Sayuj Krishnan's certified German training in Full Endoscopic Spine Surgery. Learn about his international observership, advanced techniques, and how German precision benefits patients in Hyderabad.",German Training in Endoscopic Spine Surgery,715,https://www.drsayuj.info/german-training,"index, follow",Place;CollegeOrUniversity;OpeningHoursSpecification;AggregateRating;MedicalSpecialty;State;BreadcrumbList;Hospital;ReserveAction;Offer;WebSite;MedicalService;Physician;PropertyValue;GeoCoordinates;Organization;City;PostalAddress;OfferCatalog;ListItem;EducationalOccupationalCredential;MedicalProcedure;Country
https://www.drsayuj.info/disease-guides,200,Disease Guides & Medical Conditions | Dr. Sayuj Krishnan | Comprehensive Health Information,"Comprehensive disease guides for degenerative disc disease, spinal stenosis, trigeminal neuralgia, epilepsy, herniated disc, and other neurological conditions. Expert medical information.",Disease Guides & Medical Conditions,1187,https://www.drsayuj.info/disease-guides/,"index, follow",Place;MedicalCondition;CollegeOrUniversity;OpeningHoursSpecification;AggregateRating;MedicalSpecialty;State;BreadcrumbList;Hospital;ReserveAction;Offer;MedicalWebPage;WebSite;MedicalBusiness;MedicalService;Physician;PropertyValue;GeoCoordinates;Organization;City;PostalAddress;OfferCatalog;ListItem;EducationalOccupationalCredential;MedicalProcedure;Country
https://www.drsayuj.info/emergency-rehabilitation,200,Emergency Neurosurgery & Rehabilitation Services | Dr. Sayuj Krishnan | 24/7 Care,"24/7 emergency neurosurgical consultation, hotline support, and comprehensive rehabilitation partnerships in Hyderabad. Immediate care for brain and spine emergencies.",Emergency & Rehabilitation Services,925,https://www.drsayuj.info/emergency-rehabilitation/,"index, follow",Place;GeoCircle;CollegeOrUniversity;OpeningHoursSpecification;AggregateRating;MedicalSpecialty;State;BreadcrumbList;Hospital;ReserveAction;Offer;MedicalWebPage;WebSite;MedicalBusiness;MedicalService;Physician;PropertyValue;GeoCoordinates;Organization;City;PostalAddress;MedicalClinic;OfferCatalog;ListItem;EducationalOccupationalCredential;MedicalProcedure;Country
https://www.drsayuj.info/patient-stories/lumbar-miss-tlif-recovery,200,Walking Pain-Free After TLIF | Patient Success Story | Dr.…,A 52-year-old operations manager with refractory spondylolisthesis pain underwent single-level TLIF with navigation. She resumed desk work in three weeks…,Walking Pain-Free After TLIF,611,https://www.drsayuj.info/patient-stories/lumbar-miss-tlif-recovery,"index, follow",Place;CollegeOrUniversity;OpeningHoursSpecification;AggregateRating;MedicalSpecialty;State;BreadcrumbList;Hospital;ReserveAction;Offer;WebSite;MedicalService;Physician;PropertyValue;GeoCoordinates;Organization;City;Article;PostalAddress;OfferCatalog;WebPage;ListItem;EducationalOccupationalCredential;MedicalProcedure;Person;Country
https://www.drsayuj.info/services/endoscopic-spine-surgery-hyderabad,200,Endoscopic Spine Surgery Hyderabad | Same Day Discharge,Best Endoscopic Spine Surgery in Hyderabad. Dr. Sayuj performs 7mm Keyhole Surgery with Same-Day Discharge. Check Cost & Recovery Time.,Endoscopic Spine Surgery in Hyderabad | Minimally Invasive Keyhole Surgery,3203,https://www.drsayuj.info/services/endoscopic-spine-surgery-hyderabad,"index, follow",Place;FAQPage;CollegeOrUniversity;OpeningHoursSpecification;AggregateRating;MedicalSpecialty;State;BreadcrumbList;Hospital;ReserveAction;Offer;WebSite;MedicalService;Physician;PropertyValue;Question;GeoCoordinates;Organization;City;Answer;PostalAddress;MedicalClinic;OfferCatalog;ListItem;EducationalOccupationalCredential;AdministrativeArea;MedicalProcedure;Country
https://www.drsayuj.info/appointments?utm_source=site&utm_medium=cta&utm_campaign=footer_nap,200,Book Appointment | Best Neurosurgeon Hyderabad,"Book Appointment with Dr. Sayuj Krishnan, the Best Neurosurgeon in Hyderabad. Schedule a consultation for Neurosurgery, Spine Surgery & Brain Tumor Surgery.",Book your consultation with;Dr. Sayuj Krishnan,527,https://www.drsayuj.info/appointments,"index, follow",Place;FAQPage;CollegeOrUniversity;OpeningHoursSpecification;AggregateRating;MedicalSpecialty;State;BreadcrumbList;Hospital;ReserveAction;Offer;MedicalWebPage;WebSite;MedicalAudience;MedicalService;Physician;PropertyValue;Question;GeoCoordinates;Organization;City;Answer;PostalAddress;Audience;MedicalClinic;OfferCatalog;ListItem;EducationalOccupationalCredential;AdministrativeArea;MedicalProcedure;Person;Country
https://www.drsayuj.info/symptoms-checker,200,Symptom Checker | Dr Sayuj Krishnan - AI-Powered Symptom Analysis,Use our AI-powered symptom checker to get preliminary guidance about your symptoms. Not a diagnosis - always consult with Dr. Sayuj for proper evaluation.,AI-Powered Symptom Checker,534,https://www.drsayuj.info/symptoms-checker,"index, follow",Place;CollegeOrUniversity;OpeningHoursSpecification;AggregateRating;MedicalSpecialty;State;BreadcrumbList;Hospital;ReserveAction;Offer;SoftwareApplication;MedicalWebPage;WebSite;MedicalService;Physician;PropertyValue;GeoCoordinates;Organization;City;PostalAddress;OfferCatalog;ListItem;EducationalOccupationalCredential;MedicalProcedure;Person;Country
