URL,Status,Title,Meta Description,H1,Word Count,Canonical,Robots,Schema Types
https://www.drsayuj.info/conditions/slip-disc-treatment-hyderabad,200,Slip Disc Treatment in Hyderabad | Endoscopic Discectomy |…,"Comprehensive slip disc treatment in Hyderabad: Conservative care, Pain Management, and Minimally Invasive Endoscopic Discectomy. Expert care by Dr. Sayuj…",Slip Disc Treatment in Hyderabad | Comprehensive Care,1503,https://www.drsayuj.info/conditions/slip-disc-treatment-hyderabad/,"index, follow",Place;FAQPage;MedicalCondition;CollegeOrUniversity;OpeningHoursSpecification;AggregateRating;MedicalSpecialty;State;Hospital;ReserveAction;Offer;MedicalWebPage;WebSite;MedicalAudience;MedicalService;Physician;PropertyValue;Question;GeoCoordinates;Organization;City;Answer;PostalAddress;OfferCatalog;EducationalOccupationalCredential;MedicalProcedure;Person;Country;MedicalTherapy
https://www.drsayuj.info/symptoms/signs-of-brain-tumor,200,Signs of Brain Tumor — When to Seek a Neurosurgeon in Hyderabad,"Understand early warning signs, emergency red flags, and the diagnostic pathway for suspected brain tumours with Dr. Sayuj Krishnan in Hyderabad.",Signs of a Brain Tumor,989,https://www.drsayuj.info/symptoms/signs-of-brain-tumor,"index, follow",Place;FAQPage;MedicalCondition;CollegeOrUniversity;OpeningHoursSpecification;AggregateRating;MedicalSpecialty;State;BreadcrumbList;Hospital;ReserveAction;Offer;MedicalWebPage;WebSite;MedicalService;Physician;PropertyValue;Question;GeoCoordinates;Organization;City;Answer;PostalAddress;MedicalClinic;OfferCatalog;ListItem;EducationalOccupationalCredential;MedicalProcedure;Country
https://www.drsayuj.info/blog/sciatica-vs-normal-back-pain-guide,200,Sciatica vs. Normal Back Pain: How to Tell the Difference |…,"Confused if you have sciatica or just back pain? This guide explains the symptoms, red flags, and when to see a neurosurgeon in Hyderabad.",Sciatica vs. Normal Back Pain: How to Tell the Difference,2037,https://www.drsayuj.info/blog/sciatica-vs-normal-back-pain-guide,"index, follow",Place;FAQPage;CollegeOrUniversity;OpeningHoursSpecification;AggregateRating;MedicalSpecialty;State;BreadcrumbList;Hospital;ReserveAction;Offer;MedicalWebPage;WebSite;MedicalService;Physician;PropertyValue;Question;GeoCoordinates;Organization;City;Answer;PostalAddress;OfferCatalog;ListItem;EducationalOccupationalCredential;MedicalProcedure;Person;Country
https://www.drsayuj.info/blog/deep-brain-stimulation-dbs-parkinsons-hyderabad,200,Deep Brain Stimulation (DBS) for Parkinson's in Hyderabad:…,"Considering DBS surgery for Parkinson's in Hyderabad? Learn about the cost, eligibility, recovery, and finding the best neurosurgeon for deep brain stimul…","Deep Brain Stimulation (DBS) for Parkinson's in Hyderabad: Cost, Procedure & Recovery",1795,https://www.drsayuj.info/blog/deep-brain-stimulation-dbs-parkinsons-hyderabad,"index, follow",Place;FAQPage;CollegeOrUniversity;OpeningHoursSpecification;AggregateRating;MedicalSpecialty;State;BreadcrumbList;Hospital;ReserveAction;Offer;MedicalWebPage;WebSite;MedicalService;Physician;PropertyValue;Question;GeoCoordinates;Organization;City;Answer;PostalAddress;OfferCatalog;ListItem;EducationalOccupationalCredential;MedicalProcedure;Person;Country
https://www.drsayuj.info/technology-facilities,200,Neurosurgery Technology Hyderabad | Dr Sayuj,"Explore our cutting-edge neurosurgery technology including 3T MRI, neuronavigation, endoscopic systems, intraoperative monitoring, and AI-assisted surgical planning in Hyderabad.",Advanced Technology & Facilities,1000,https://www.drsayuj.info/technology-facilities/,"index, follow",Place;CollegeOrUniversity;OpeningHoursSpecification;AggregateRating;MedicalSpecialty;State;MedicalDevice;BreadcrumbList;Hospital;ReserveAction;Offer;MedicalWebPage;WebSite;MedicalBusiness;MedicalService;Physician;PropertyValue;GeoCoordinates;Organization;City;PostalAddress;OfferCatalog;ListItem;EducationalOccupationalCredential;MedicalProcedure;Country
https://www.drsayuj.info/blog/trigeminal-neuralgia-vs-tooth-pain-guide,200,Trigeminal Neuralgia vs. Tooth Pain: Why Your Face Hurts Li…,"Toothache or trigeminal neuralgia? Signs of electric shock facial pain, common misdiagnoses, and treatment options in Hyderabad.",Trigeminal Neuralgia vs. Tooth Pain: Why Your Face Hurts Like a Shock,1960,https://www.drsayuj.info/blog/trigeminal-neuralgia-vs-tooth-pain-guide,"index, follow",BlogPosting;Place;FAQPage;CollegeOrUniversity;OpeningHoursSpecification;AggregateRating;MedicalSpecialty;State;BreadcrumbList;Hospital;ReserveAction;Offer;MedicalWebPage;WebSite;MedicalService;Physician;PropertyValue;Question;GeoCoordinates;Organization;City;Answer;PostalAddress;OfferCatalog;ListItem;EducationalOccupationalCredential;MedicalProcedure;Person;Country
https://www.drsayuj.info/locations/neurosurgeon-kukatpally,200,"Neurosurgeon near Kukatpally, Hyderabad | Dr Sayuj Krishnan",Expert neurosurgeon near Kukatpally. Dr Sayuj Krishnan provides advanced brain and spine surgery. Convenient access via Metro or road.,"Neurosurgeon Near Kukatpally, Hyderabad",553,https://www.drsayuj.info/locations/neurosurgeon-kukatpally,"index, follow",Place;FAQPage;CollegeOrUniversity;OpeningHoursSpecification;AggregateRating;MedicalSpecialty;State;BreadcrumbList;Hospital;ReserveAction;Offer;WebSite;MedicalService;Physician;PropertyValue;Question;GeoCoordinates;Organization;City;Answer;PostalAddress;MedicalClinic;OfferCatalog;ListItem;EducationalOccupationalCredential;MedicalProcedure;Country
https://www.drsayuj.info/locations,200,Neurosurgeon Locations in Hyderabad | Dr. Sayuj Krishnan,"Expert neurosurgeon Dr. Sayuj Krishnan serves patients across Hyderabad including Banjara Hills, Hitec City, Jubilee Hills, and Malakpet. Book consultation.",Neurosurgeon Locations in Hyderabad,808,https://www.drsayuj.info/locations,"index, follow",Place;CollegeOrUniversity;OpeningHoursSpecification;AggregateRating;MedicalSpecialty;State;BreadcrumbList;Hospital;ReserveAction;Offer;MedicalWebPage;WebSite;MedicalService;Physician;PropertyValue;GeoCoordinates;Organization;City;PostalAddress;OfferCatalog;ListItem;EducationalOccupationalCredential;MedicalProcedure;Country
https://www.drsayuj.info/blog/headache-vs-brain-tumor-warning-signs,200,Headache or Brain Tumor? 7 Warning Signs You Should Not Ign…,"Worried about a brain tumor headache? Dr. Sayuj Krishnan explains the 7 critical warning signs, red flags, and migraine differences.",Headache or Brain Tumor? 7 Warning Signs You Should Not Ignore,1664,https://www.drsayuj.info/blog/headache-vs-brain-tumor-warning-signs,"index, follow",Place;FAQPage;CollegeOrUniversity;OpeningHoursSpecification;AggregateRating;MedicalSpecialty;State;BreadcrumbList;Hospital;ReserveAction;Offer;MedicalWebPage;WebSite;MedicalService;Physician;PropertyValue;Question;GeoCoordinates;Organization;City;Answer;PostalAddress;OfferCatalog;ListItem;EducationalOccupationalCredential;MedicalProcedure;Person;Country
https://www.drsayuj.info/conditions/chiari-malformation-hyderabad,200,Chiari Malformation Treatment in Hyderabad | Dr. Sayuj Kris…,Posterior fossa decompression planning for craniovertebral junction disorders causing headaches and imbalance.,Chiari Malformation,533,https://www.drsayuj.info/conditions/chiari-malformation-hyderabad,"index, follow",Place;MedicalCondition;CollegeOrUniversity;OpeningHoursSpecification;AggregateRating;MedicalSpecialty;State;BreadcrumbList;Hospital;ReserveAction;Offer;WebSite;MedicalService;Physician;PropertyValue;GeoCoordinates;Organization;City;PostalAddress;OfferCatalog;ListItem;EducationalOccupationalCredential;MedicalProcedure;Country;MedicalTherapy;MedicalSignOrSymptom
https://www.drsayuj.info/blog/cervical-radiculopathy-arm-pain-hyderabad,200,Cervical Radiculopathy: Why Your Neck Pain Shoots Down Your…,"Dr. Sayuj Krishnan explains Cervical Radiculopathy (pinched nerve): causes, symptoms like arm numbness, and advanced treatments in Hyderabad.",Cervical Radiculopathy: Why Your Neck Pain Shoots Down Your Arm,1850,https://www.drsayuj.info/blog/cervical-radiculopathy-arm-pain-hyderabad,"index, follow",Place;FAQPage;CollegeOrUniversity;OpeningHoursSpecification;AggregateRating;MedicalSpecialty;State;BreadcrumbList;Hospital;ReserveAction;Offer;MedicalWebPage;WebSite;MedicalService;Physician;PropertyValue;Question;GeoCoordinates;Organization;City;Answer;PostalAddress;OfferCatalog;ListItem;EducationalOccupationalCredential;MedicalProcedure;Person;Country
https://www.drsayuj.info/blog/sleeping-positions-for-sciatica-relief-guide,200,How to Sleep with Sciatica: Best Positions for Pain Relief…,"Struggling to sleep with sciatica? Learn the best sleeping positions to relieve nerve pain, choose the right mattress, and wake up pain-free in Hyderabad.",How to Sleep with Sciatica: Best Positions for Pain Relief,1948,https://www.drsayuj.info/blog/sleeping-positions-for-sciatica-relief-guide,"index, follow",Place;FAQPage;CollegeOrUniversity;OpeningHoursSpecification;AggregateRating;MedicalSpecialty;State;BreadcrumbList;Hospital;ReserveAction;Offer;MedicalWebPage;WebSite;MedicalService;Physician;PropertyValue;Question;GeoCoordinates;Organization;City;Answer;PostalAddress;OfferCatalog;ListItem;EducationalOccupationalCredential;MedicalProcedure;Person;Country
https://www.drsayuj.info/blog/lumbar-canal-stenosis-walking-pain-hyderabad,200,Why Walking Hurts: A Guide to Lumbar Canal Stenosis for Sen…,"Leg pain when walking that goes away when sitting is a classic sign of lumbar canal stenosis. Learn about symptoms, diagnosis, and treatment in Hyderabad.",Why Walking Hurts: A Guide to Lumbar Canal Stenosis for Seniors,1502,https://www.drsayuj.info/blog/lumbar-canal-stenosis-walking-pain-hyderabad,"index, follow",Place;FAQPage;CollegeOrUniversity;OpeningHoursSpecification;AggregateRating;MedicalSpecialty;State;BreadcrumbList;Hospital;ReserveAction;Offer;MedicalWebPage;WebSite;MedicalService;Physician;PropertyValue;Question;GeoCoordinates;Organization;City;Answer;PostalAddress;OfferCatalog;ListItem;EducationalOccupationalCredential;MedicalProcedure;Person;Country
https://www.drsayuj.info/blog/cervical-disc-replacement-vs-fusion-acdf-hyderabad,200,Cervical Disc Replacement vs. Fusion (ACDF): Which is Best…,"Cervical Disc Replacement (ADR) vs ACDF Fusion: A neurosurgeon's guide to choosing the right neck surgery. Compare recovery, motion, and costs in Hyderaba…",Cervical Disc Replacement vs. Fusion (ACDF): Which is Best for You?,1682,https://www.drsayuj.info/blog/cervical-disc-replacement-vs-fusion-acdf-hyderabad,"index, follow",Place;FAQPage;CollegeOrUniversity;OpeningHoursSpecification;AggregateRating;MedicalSpecialty;State;BreadcrumbList;Hospital;ReserveAction;Offer;MedicalWebPage;WebSite;MedicalService;Physician;PropertyValue;Question;GeoCoordinates;Organization;City;Answer;PostalAddress;OfferCatalog;ListItem;EducationalOccupationalCredential;MedicalProcedure;Person;Country
https://www.drsayuj.info/conditions,200,Neurological Conditions A–Z | Dr. Sayuj Krishnan,"Browse an A–Z index of brain, spine, and nerve conditions treated by Dr. Sayuj Krishnan with links to detailed guides and treatment options.",Conditions We Treat – A to Z,2193,https://www.drsayuj.info/conditions,"index, follow",Place;CollegeOrUniversity;OpeningHoursSpecification;AggregateRating;MedicalSpecialty;State;Hospital;ReserveAction;Offer;WebSite;MedicalService;Physician;PropertyValue;GeoCoordinates;Organization;City;PostalAddress;OfferCatalog;EducationalOccupationalCredential;MedicalProcedure;Country
https://www.drsayuj.info/blog/brain-metastases-treatment-survival-guide-hyderabad,200,Brain Metastases: Treatment Options & Survival Guide in Hyd…,"Brain metastases (secondary brain tumors) treatment guide Hyderabad. SRS, surgery, survival rates, and symptoms. Dr. Sayuj Krishnan explains options.",Brain Metastases: Treatment Options & Survival Guide in Hyderabad,1647,https://www.drsayuj.info/blog/brain-metastases-treatment-survival-guide-hyderabad,"index, follow",Place;FAQPage;CollegeOrUniversity;OpeningHoursSpecification;AggregateRating;MedicalSpecialty;State;BreadcrumbList;Hospital;ReserveAction;Offer;MedicalWebPage;WebSite;MedicalService;Physician;PropertyValue;Question;GeoCoordinates;Organization;City;Answer;PostalAddress;OfferCatalog;ListItem;EducationalOccupationalCredential;MedicalProcedure;Person;Country
https://www.drsayuj.info/services/brain-tumor-surgery-hyderabad,200,"Brain Tumor Surgery Hyderabad: Cost, Safety & Dr. Sayuj",Looking for Brain Tumor Surgery in Hyderabad? Dr. Sayuj uses Awake Craniotomy & Neuronavigation for 100% safe tumor removal. Check Cost & Recovery.,Advanced Brain Tumor Surgery in Hyderabad,1910,https://www.drsayuj.info/services/brain-tumor-surgery-hyderabad,"index, follow",Place;FAQPage;CollegeOrUniversity;OpeningHoursSpecification;AggregateRating;MedicalSpecialty;State;BreadcrumbList;Hospital;ReserveAction;Offer;MedicalWebPage;WebSite;MedicalAudience;MedicalService;Physician;PropertyValue;Question;GeoCoordinates;Organization;City;Answer;PostalAddress;MedicalClinic;OfferCatalog;ListItem;EducationalOccupationalCredential;AdministrativeArea;MedicalProcedure;Person;Country
https://www.drsayuj.info/neurosurgeon-malakpet,200,Neurosurgeon Malakpet: Spine & Brain Specialist Dr. Sayuj,"Dr. Sayuj Krishnan at Yashoda Hospital Malakpet offers Daycare Endoscopic Spine Surgery, brain tumor care, and 24/7 emergency neurosurgery. Book a visit.",Dr. Sayuj Krishnan - Neurosurgeon in Malakpet;& Brain-Spine Specialist,1775,https://www.drsayuj.info/neurosurgeon-malakpet,"index, follow",Place;FAQPage;CollegeOrUniversity;OpeningHoursSpecification;AggregateRating;MedicalSpecialty;State;BreadcrumbList;Hospital;ReserveAction;Offer;WebSite;MedicalService;Physician;PropertyValue;Question;GeoCoordinates;Organization;City;Answer;PostalAddress;MedicalClinic;OfferCatalog;ListItem;EducationalOccupationalCredential;MedicalProcedure;Country
https://www.drsayuj.info/blog/awake-spine-surgery-vs-general-anesthesia-guide,200,Awake Spine Surgery vs. General Anesthesia: Which is Safer?…,"Awake spine surgery vs general anesthesia: safety benefits, faster recovery, and why it suits elderly/high-risk patients in Hyderabad.",Awake Spine Surgery vs. General Anesthesia: Which is Safer?,1838,https://www.drsayuj.info/blog/awake-spine-surgery-vs-general-anesthesia-guide,"index, follow",Place;FAQPage;CollegeOrUniversity;OpeningHoursSpecification;AggregateRating;MedicalSpecialty;State;BreadcrumbList;Hospital;ReserveAction;Offer;MedicalWebPage;WebSite;MedicalService;Physician;PropertyValue;Question;GeoCoordinates;Organization;City;Answer;PostalAddress;OfferCatalog;ListItem;EducationalOccupationalCredential;MedicalProcedure;Person;Country
https://www.drsayuj.info/services/robotic-spine-surgery-hyderabad,200,Robotic Spine Surgery Hyderabad | Dr. Sayuj Krishnan,"Advanced robotic spine surgery in Hyderabad. High precision, minimal radiation, and faster recovery with AI-driven surgical planning at Yashoda Hospital.",Robotic Spine Surgery in Hyderabad,1118,https://www.drsayuj.info/services/robotic-spine-surgery-hyderabad,"index, follow",Place;FAQPage;CollegeOrUniversity;OpeningHoursSpecification;AggregateRating;MedicalSpecialty;State;BreadcrumbList;Hospital;ReserveAction;Offer;MedicalWebPage;WebSite;MedicalAudience;MedicalService;Physician;PropertyValue;Question;GeoCoordinates;Organization;City;Answer;PostalAddress;OfferCatalog;ListItem;EducationalOccupationalCredential;MedicalProcedure;Person;Country
https://www.drsayuj.info/about,200,Best Neurosurgeon Hyderabad | Dr. Sayuj Krishnan,Dr. Sayuj Krishnan is a German-trained Neurosurgeon in Hyderabad with 9+ Years of experience. Specialist in Endoscopic Spine & Brain Surgery. Read Profile.,About Dr. Sayuj Krishnan,1267,https://www.drsayuj.info/about,"index, follow",Place;CollegeOrUniversity;OpeningHoursSpecification;AggregateRating;MedicalSpecialty;State;BreadcrumbList;Hospital;ReserveAction;Offer;MedicalWebPage;WebSite;MedicalAudience;MedicalService;Physician;PropertyValue;GeoCoordinates;Organization;City;PostalAddress;OfferCatalog;ListItem;EducationalOccupationalCredential;MedicalProcedure;Person;Country
https://www.drsayuj.info/blog/foot-drop-recovery-guide-hyderabad,200,"Foot Drop (Drop Foot) Recovery Guide: Causes, Treatment & S…","Foot drop (L5 radiculopathy) is a serious neurological condition. Learn the causes, warning signs, and when spine surgery is needed to restore movement.","Foot Drop (Drop Foot) Recovery Guide: Causes, Treatment & Surgery",1500,https://www.drsayuj.info/blog/foot-drop-recovery-guide-hyderabad,"index, follow",Place;FAQPage;CollegeOrUniversity;OpeningHoursSpecification;AggregateRating;MedicalSpecialty;State;BreadcrumbList;Hospital;ReserveAction;Offer;MedicalWebPage;WebSite;MedicalService;Physician;PropertyValue;Question;GeoCoordinates;Organization;City;Answer;PostalAddress;OfferCatalog;ListItem;EducationalOccupationalCredential;MedicalProcedure;Person;Country
https://www.drsayuj.info/best-neurosurgeon-in-hyderabad,200,Best Neurosurgeon in Hyderabad | 1000+ Cases | Dr Sayuj,Looking for the best neurosurgeon in Hyderabad? Dr. Sayuj Krishnan specializes in minimally invasive spine & brain surgery. 90% non-surgical success. Book now.,Best Neurosurgeon in Hyderabad — Evidence-Based Brain & Spine Care,1249,https://www.drsayuj.info/best-neurosurgeon-in-hyderabad/,"index, follow",Place;FAQPage;HowToSupply;ImageObject;MedicalCondition;CollegeOrUniversity;OpeningHoursSpecification;AggregateRating;MedicalSpecialty;State;BreadcrumbList;Hospital;ReserveAction;Offer;MedicalWebPage;WebSite;MedicalService;Physician;PropertyValue;Question;GeoCoordinates;Organization;City;HowToStep;Answer;PostalAddress;HowToTool;SpeakableSpecification;OfferCatalog;HowTo;WebPage;ListItem;EducationalOccupationalCredential;MedicalProcedure;Country
https://www.drsayuj.info/conditions/brain-aneurysm-treatment-hyderabad,200,Brain Aneurysm Treatment in Hyderabad | Dr. Sayuj Krishnan,Emergency evaluation and microsurgical or endovascular strategies for ruptured and unruptured aneurysms.,Brain Aneurysm,604,https://www.drsayuj.info/conditions/brain-aneurysm-treatment-hyderabad,"index, follow",Place;FAQPage;MedicalCondition;CollegeOrUniversity;OpeningHoursSpecification;AggregateRating;MedicalSpecialty;State;BreadcrumbList;Hospital;ReserveAction;Offer;WebSite;MedicalService;Physician;PropertyValue;Question;GeoCoordinates;Organization;City;Answer;PostalAddress;OfferCatalog;ListItem;EducationalOccupationalCredential;MedicalProcedure;Country;MedicalTherapy;MedicalSignOrSymptom
https://www.drsayuj.info/appointments,200,Book Appointment | Best Neurosurgeon Hyderabad,"Book Appointment with Dr. Sayuj Krishnan, the Best Neurosurgeon in Hyderabad. Schedule a consultation for Neurosurgery, Spine Surgery & Brain Tumor Surgery.",Book your consultation with;Dr. Sayuj Krishnan,527,https://www.drsayuj.info/appointments,"index, follow",Place;FAQPage;CollegeOrUniversity;OpeningHoursSpecification;AggregateRating;MedicalSpecialty;State;BreadcrumbList;Hospital;ReserveAction;Offer;MedicalWebPage;WebSite;MedicalAudience;MedicalService;Physician;PropertyValue;Question;GeoCoordinates;Organization;City;Answer;PostalAddress;Audience;MedicalClinic;OfferCatalog;ListItem;EducationalOccupationalCredential;AdministrativeArea;MedicalProcedure;Person;Country
https://www.drsayuj.info,200,Best Neurosurgeon Hyderabad | Dr Sayuj | Spine & Brain,Looking for the Best Neurosurgeon in Hyderabad? Dr. Sayuj is a German-trained expert in Endoscopic Spine & Brain Surgery at Yashoda Hospital. Book Now.,Dr. Sayuj Krishnan: German-Trained Neurosurgeon in Hyderabad,1486,https://www.drsayuj.info,"index, follow",Place;FAQPage;CollegeOrUniversity;OpeningHoursSpecification;AggregateRating;MedicalSpecialty;State;BreadcrumbList;Hospital;ReserveAction;Offer;MedicalWebPage;WebSite;MedicalAudience;MedicalService;Physician;PropertyValue;Question;GeoCoordinates;Organization;City;Answer;PostalAddress;Audience;OfferCatalog;ListItem;EducationalOccupationalCredential;MedicalProcedure;Person;Country
https://www.drsayuj.info/editorial-policy,200,Editorial Policy | Dr Sayuj Krishnan,Editorial policy and content standards for medical information provided on Dr Sayuj Krishnan's website.,Editorial Policy,733,https://www.drsayuj.info/editorial-policy,"index, follow",Place;CollegeOrUniversity;OpeningHoursSpecification;AggregateRating;MedicalSpecialty;State;BreadcrumbList;Hospital;ReserveAction;Offer;WebSite;MedicalService;Physician;PropertyValue;GeoCoordinates;Organization;City;PostalAddress;OfferCatalog;ListItem;EducationalOccupationalCredential;MedicalProcedure;Country
https://www.drsayuj.info/locations/lb-nagar,200,Best Neurosurgeon near LB Nagar | 10 Min Drive | Dr. Sayuj,"Expert Neurosurgeon for LB Nagar & Vanasthalipuram. Dr. Sayuj offers Endoscopic Spine Surgery, Brain Tumor care & Trauma services at Yashoda Malakpet (10 mins away).","Best Neurosurgeon near LB Nagar, Hyderabad",867,https://www.drsayuj.info/locations/lb-nagar,"index, follow",Place;FAQPage;CollegeOrUniversity;OpeningHoursSpecification;AggregateRating;MedicalSpecialty;State;BreadcrumbList;Hospital;ReserveAction;Offer;WebSite;MedicalService;Physician;PropertyValue;Question;GeoCoordinates;Organization;City;Answer;PostalAddress;MedicalClinic;OfferCatalog;ListItem;EducationalOccupationalCredential;MedicalProcedure;Country
https://www.drsayuj.info/blog/chronic-subdural-hematoma-symptoms-elderly,200,Is It Dementia or a Brain Bleed? Chronic Subdural Hematoma…,"Chronic Subdural Hematoma (cSDH) in elderly: confusion, balance loss. Learn why this 'reversible dementia' needs urgent neurosurgery in Hyderabad.",Is It Dementia or a Brain Bleed? Chronic Subdural Hematoma in the Elderly,1464,https://www.drsayuj.info/blog/chronic-subdural-hematoma-symptoms-elderly,"index, follow",Place;FAQPage;CollegeOrUniversity;OpeningHoursSpecification;AggregateRating;MedicalSpecialty;State;BreadcrumbList;Hospital;ReserveAction;Offer;MedicalWebPage;WebSite;MedicalService;Physician;PropertyValue;Question;GeoCoordinates;Organization;City;Answer;PostalAddress;OfferCatalog;ListItem;EducationalOccupationalCredential;MedicalProcedure;Person;Country
https://www.drsayuj.info/conditions/cervical-radiculopathy-treatment-hyderabad,200,Cervical Radiculopathy Treatment Hyderabad | Pinched Nerve Surgery,Expert treatment for cervical radiculopathy (pinched nerve) in Hyderabad. Keyhole surgery (Foraminotomy) and ACDF by Dr. Sayuj Krishnan.,Cervical Radiculopathy (Pinched Nerve) Treatment in Hyderabad,1371,https://www.drsayuj.info/conditions/cervical-radiculopathy-treatment-hyderabad,"index, follow",Place;FAQPage;MedicalCondition;CollegeOrUniversity;OpeningHoursSpecification;AggregateRating;MedicalSpecialty;State;BreadcrumbList;Hospital;ReserveAction;Offer;MedicalWebPage;WebSite;MedicalService;Physician;PropertyValue;Question;GeoCoordinates;Organization;City;Answer;PostalAddress;MedicalClinic;OfferCatalog;ListItem;EducationalOccupationalCredential;MedicalProcedure;Country
https://www.drsayuj.info/conditions/acoustic-neuroma-treatment-hyderabad,200,Acoustic Neuroma Treatment in Hyderabad | Dr. Sayuj Krishnan,Hearing-preserving microsurgery and radiosurgery options for vestibular schwannoma causing imbalance or tinnitus.,Acoustic Neuroma,577,https://www.drsayuj.info/conditions/acoustic-neuroma-treatment-hyderabad,"index, follow",Place;FAQPage;MedicalCondition;CollegeOrUniversity;OpeningHoursSpecification;AggregateRating;MedicalSpecialty;State;BreadcrumbList;Hospital;ReserveAction;Offer;WebSite;MedicalService;Physician;PropertyValue;Question;GeoCoordinates;Organization;City;Answer;PostalAddress;OfferCatalog;ListItem;EducationalOccupationalCredential;MedicalProcedure;Country;MedicalTherapy;MedicalSignOrSymptom
https://www.drsayuj.info/blog/cost-of-endoscopic-spine-surgery-hyderabad,200,Cost of Endoscopic Spine Surgery in Hyderabad: 2026 Price G…,"Endoscopic spine surgery cost in Hyderabad: package ranges, insurance approvals, and why keyhole surgery can lower total recovery costs.",Cost of Endoscopic Spine Surgery in Hyderabad: 2026 Price Guide,1266,https://www.drsayuj.info/blog/cost-of-endoscopic-spine-surgery-hyderabad,"index, follow",BlogPosting;Place;FAQPage;CollegeOrUniversity;OpeningHoursSpecification;AggregateRating;MedicalSpecialty;State;BreadcrumbList;Hospital;ReserveAction;Offer;MedicalWebPage;WebSite;MedicalService;Physician;PropertyValue;Question;GeoCoordinates;Organization;City;Answer;PostalAddress;OfferCatalog;ListItem;EducationalOccupationalCredential;MedicalProcedure;Person;Country
https://www.drsayuj.info/blog/glioblastoma-multiforme-treatment-survival-guide-hyderabad,200,"Glioblastoma Multiforme (GBM): Symptoms, Treatment & Surviv…","Comprehensive guide to Glioblastoma Multiforme (GBM) treatment in Hyderabad. Learn about symptoms, awake craniotomy, radiation, and survival rates.","Glioblastoma Multiforme (GBM): Symptoms, Treatment & Survival Guide",1673,https://www.drsayuj.info/blog/glioblastoma-multiforme-treatment-survival-guide-hyderabad,"index, follow",Place;FAQPage;CollegeOrUniversity;OpeningHoursSpecification;AggregateRating;MedicalSpecialty;State;BreadcrumbList;Hospital;ReserveAction;Offer;MedicalWebPage;WebSite;MedicalService;Physician;PropertyValue;Question;GeoCoordinates;Organization;City;Answer;PostalAddress;OfferCatalog;ListItem;EducationalOccupationalCredential;MedicalProcedure;Person;Country
