Path,Status,Title,Description,H1,Canonical,Robots,WordCount
/locations/secunderabad,200,"Neurosurgeon in Secunderabad | Dr. Sayuj Krishnan","Consult Dr. Sayuj Krishnan near Secunderabad for endoscopic spine &amp; minimally invasive brain surgery. OPD timings, parking, directions.","Neurosurgeon in Secunderabad","https://www.drsayuj.info/neurosurgeon-secunderabad","index, follow",521
/media,200,"Media Publications &amp; Expert Articles | Dr. Sayuj Krishnan","Expert articles, media coverage, and publications by Dr. Sayuj Krishnan on neurosurgery, spine surgery, and minimally invasive techniques in leading healthcare publications.","Media Publications &amp; Expert Articles","https://www.drsayuj.info/media","index, follow",861
/medical-disclaimer,200,"Medical Disclaimer | Dr Sayuj Krishnan","Important medical disclaimer and terms of use for information provided on Dr Sayuj Krishnan&#x27;s website.","Medical Disclaimer","https://www.drsayuj.info/medical-disclaimer","index, follow",673
/neurosurgeon-banjara-hills,200,"Neurosurgeon in Banjara Hills, Hyderabad | Endoscopic Spine | Dr. Sayuj Krishnan","Consult Dr. Sayuj Krishnan near Banjara Hills, Hyderabad for endoscopic spine &amp; minimally invasive brain surgery. OPD timings, parking, directions, WhatsApp booking, and FAQs.","Neurosurgeon in Banjara Hills, Hyderabad","https://www.drsayuj.info/neurosurgeon-banjara-hills","index, follow",570
/neurosurgeon-gachibowli,200,"Neurosurgeon in Gachibowli, Hyderabad | Endoscopic Spine | Dr. Sayuj Krishnan","Consult Dr. Sayuj Krishnan near Gachibowli, Hyderabad for endoscopic spine &amp; minimally invasive brain surgery. OPD timings, parking, directions, WhatsApp booking, and FAQs.","Neurosurgeon in Gachibowli, Hyderabad","https://www.drsayuj.info/neurosurgeon-gachibowli","index, follow",556
/neurosurgeon-hitech-city,200,"Neurosurgeon in Hitech City, Hyderabad | Endoscopic Spine | Dr. Sayuj Krishnan","Consult Dr. Sayuj Krishnan near Hitech City, Hyderabad for endoscopic spine &amp; minimally invasive brain surgery. OPD timings, parking, directions, WhatsApp booking, and FAQs.","Neurosurgeon in Hitech City, Hyderabad","https://www.drsayuj.info/neurosurgeon-hitech-city","index, follow",660
/neurosurgeon-hyderabad,200,"Best Neurosurgeon Hyderabad | Endoscopic Spine Specialist","Consult Dr. Sayuj Krishnan, neurosurgeon in Hyderabad. Expert in endoscopic spine &amp; minimally invasive brain surgery. OPD timings &amp; booking.","Neurosurgeon in Hyderabad — Endoscopic Spine &amp; Minimally Invasive Brain Surgery","https://www.drsayuj.info/neurosurgeon-hyderabad","index, follow",759
/neurosurgeon-jubilee-hills,200,"Neurosurgeon Jubilee Hills | Endoscopic Spine | Dr Sayuj","Expert neurosurgeon for Jubilee Hills patients. Endoscopic spine &amp; brain tumor surgery. 20 min drive. Book consult with Dr. Sayuj.","Best Neurosurgeon in Jubilee Hills, Hyderabad","https://www.drsayuj.info/neurosurgeon-jubilee-hills","index, follow",967
/neurosurgeon-malakpet,200,"Dr. Sayuj Krishnan - Neurosurgeon in Malakpet | Yashoda Hospitals","Dr. Sayuj Krishnan at Yashoda Hospital Malakpet offers Daycare Endoscopic Spine Surgery, brain tumor care, and 24/7 emergency neurosurgery. Book a visit.","Dr. Sayuj Krishnan - Neurosurgeon in Malakpet &amp; Brain-Spine Specialist","https://www.drsayuj.info/neurosurgeon-malakpet","index, follow",1238
/neurosurgeon-secunderabad,200,"Neurosurgeon in Secunderabad, Hyderabad | Endoscopic Spine | Dr. Sayuj Krishnan","Consult Dr. Sayuj Krishnan near Secunderabad, Hyderabad for endoscopic spine &amp; minimally invasive brain surgery. OPD timings, parking, directions, WhatsApp booking, and FAQs.","Neurosurgeon in Secunderabad, Hyderabad","https://www.drsayuj.info/neurosurgeon-secunderabad","index, follow",554
/patient-stories,200,"Patient Success Stories | Neurosurgery &amp; Spine Surgery Hyderabad","Real patient stories of successful neurosurgery and spine surgery outcomes at Yashoda Hospital Malakpet with Dr. Sayuj Krishnan.","Patient Success Stories","https://www.drsayuj.info/patient-stories","index, follow",846
/pediatric-neurosurgery,200,"Pediatric Neurosurgery Hyderabad | Children&#x27;s Brain &amp; Spine Surgery | Dr. Sayuj Krishnan","Expert pediatric neurosurgery in Hyderabad with Dr. Sayuj Krishnan. Specializing in children&#x27;s brain surgery, spine surgery, and neurological conditions with compassionate care.","Pediatric Neurosurgery","https://www.drsayuj.info/pediatric-neurosurgery","index, follow",1004
/privacy,200,"Privacy Policy | Dr Sayuj Krishnan - Neurosurgeon in Hyderabad","Privacy policy for Dr Sayuj Krishnan&#x27;s neurosurgical practice in Hyderabad. Learn how we protect your personal and medical information.","Privacy Policy","https://www.drsayuj.info/privacy","index, follow",690
/research,200,"Research &amp; Innovation | Dr. Sayuj Krishnan","Learn how Dr. Sayuj Krishnan advances neurosurgery through clinical research, conference presentations, and collaboration with international centres.","Advancing Neurosurgery Through Evidence and Collaboration","https://www.drsayuj.info/research","index, follow",661
/services,200,"Neurosurgical Services in Hyderabad | Dr. Sayuj Krishnan","Expert neurosurgical services including endoscopic spine surgery, brain tumor surgery, epilepsy surgery, and trigeminal neuralgia treatment in Hyderabad.","Neurosurgical Services","https://www.drsayuj.info/services/","index, follow",1292
/services/awake-spine-surgery-hyderabad,200,"Awake Spine Surgery Hyderabad","Awake endoscopic spine surgery for high-risk patients. Local anesthesia, no general anesthesia needed. Faster recovery &amp; same-day discharge in Hyderabad.","Awake Spine Surgery in Hyderabad","https://www.drsayuj.info/services/awake-spine-surgery-hyderabad","index, follow",892
/services/brain-tumor-surgery-hyderabad,200,"Brain Tumor Surgery Hyderabad | Awake &amp; Neuronavigation Exp…","Advanced Brain Tumor Surgery in Hyderabad using Neuronavigation &amp; Awake Craniotomy. Safe removal of complex tumors. Neuro-Oncology expert Dr Sayuj.","Advanced Brain Tumor Surgery in Hyderabad","https://www.drsayuj.info/services/brain-tumor-surgery-hyderabad","index, follow",1358
/services/cervical-disc-replacement-hyderabad,200,"Cervical Disc Replacement Surgery Hyderabad | Artificial Di…","Expert cervical disc replacement (ADR) by Dr. Sayuj Krishnan. Motion-preserving alternative to fusion for cervical spondylosis &amp; neck pain.","Cervical Disc Replacement Surgery (ADR)","https://www.drsayuj.info/services/cervical-disc-replacement-hyderabad","index, follow",1078
/services/cervical-endoscopic-spine-surgery-hyderabad,200,"Cervical Endoscopic Spine Surgery Hyderabad | Dr. Sayuj Kri…","Advanced cervical endoscopic spine surgery in Hyderabad. Treat neck pain and radiculopathy with keyhole surgery. Fast recovery, no fusion.","Cervical Endoscopic Spine Surgery in Hyderabad","https://www.drsayuj.info/services/cervical-endoscopic-spine-surgery-hyderabad","index, follow",1135
/services/compare-neurosurgeons-hyderabad,200,"Best Neurosurgeon in Hyderabad: Compare Dr. Sayuj vs Apollo…","Compare the best neurosurgeons in Hyderabad. Dr. Sayuj Krishnan vs Apollo, KIMS, Yashoda hospitals. Expert comparison of experience, techniques, and patie…","Best Neurosurgeon in Hyderabad: Compare Your Options","https://www.drsayuj.info/services/compare-neurosurgeons-hyderabad","index, follow",1030
/services/cooled-radiofrequency-ablation-hyderabad,200,"Cooled Radiofrequency Ablation Hyderabad | Dr. Sayuj Krishn…","Advanced cooled radiofrequency ablation for chronic pain relief in Hyderabad. Long-lasting nerve ablation for facet joints, sacroiliac joints, and trigemi…","Cooled Radiofrequency Ablation in Hyderabad","https://www.drsayuj.info/services/cooled-radiofrequency-ablation-hyderabad","index, follow",1584
/services/dr-sayuj-vs-apollo-neuro-icu,200,"Dr. Sayuj vs Apollo Neuro ICU: Expert Comparison for Brain…","Compare Dr. Sayuj Krishnan with Apollo Neuro ICU for brain and spine surgery. Expert analysis of techniques, outcomes, and patient care approaches in Hyde…","Dr. Sayuj vs Apollo Neuro ICU: Expert Comparison for Brain &amp; Spine Surgery","https://www.drsayuj.info/services/dr-sayuj-vs-apollo-neuro-icu","index, follow",1062
/services/endoscopic-discectomy-hyderabad,200,"Endoscopic Discectomy Hyderabad","Expert endoscopic discectomy for herniated discs in Hyderabad. Same-day surgery, faster recovery, less pain with Dr. Sayuj Krishnan.","Endoscopic Discectomy in Hyderabad","https://www.drsayuj.info/services/endoscopic-discectomy-hyderabad","index, follow",1005
/services/endoscopic-spine-surgery-hyderabad,200,"Endoscopic Spine Surgery Hyderabad | Day Care Keyhole","Advanced Endoscopic Spine Surgery in Hyderabad. 7mm incision, same-day discharge. Expert treatment for Slip Disc &amp; Sciatica. Check packages.","Endoscopic Spine Surgery in Hyderabad | Minimally Invasive Keyhole Surgery","https://www.drsayuj.info/services/endoscopic-spine-surgery-hyderabad","index, follow",2406
/services/epilepsy-surgery-hyderabad,200,"Epilepsy Surgery in Hyderabad | Drug-Resistant Epilepsy Tre…","Expert epilepsy surgery for drug-resistant epilepsy in Hyderabad. LITT, resection surgery, VNS. Comprehensive evaluation and advanced techniques.","Epilepsy Surgery in Hyderabad","https://www.drsayuj.info/services/epilepsy-surgery-hyderabad","index, follow",1109
/services/kims-spine-surgery-second-opinion,200,"KIMS Spine Surgery Second Opinion | Dr. Sayuj Krishnan Expe…","Get a second opinion on KIMS spine surgery recommendations from Dr. Sayuj Krishnan. Expert review of surgical plans, alternative treatments, and minimally…","KIMS Spine Surgery Second Opinion | Dr. Sayuj Krishnan Expert Review","https://www.drsayuj.info/services/kims-spine-surgery-second-opinion","index, follow",1124
/services/kyphoplasty-vertebroplasty-hyderabad,200,"Vertebroplasty &amp; Kyphoplasty Hyderabad | Dr. Sayuj Krishnan","Expert Vertebroplasty and Kyphoplasty in Hyderabad for osteoporotic spine fractures. Minimally invasive cement injection for instant pain relief.","Vertebroplasty &amp; Kyphoplasty in Hyderabad","https://www.drsayuj.info/services/kyphoplasty-vertebroplasty-hyderabad","index, follow",1266
/services/lumbar-laminectomy-surgery-hyderabad,200,"Lumbar Laminectomy Surgery in Hyderabad | Spinal Decompress…","Expert lumbar laminectomy surgery by Dr. Sayuj Krishnan. Relief from spinal stenosis and nerve compression. Advanced decompression techniques.","Lumbar Laminectomy (Decompression) Surgery","https://www.drsayuj.info/services/lumbar-laminectomy-surgery-hyderabad","index, follow",1154
/services/microdiscectomy-surgery-cost-hyderabad,200,"Microdiscectomy Surgery Cost in Hyderabad | 2026 Price Guide","Detailed guide to microdiscectomy surgery cost in Hyderabad. Compare prices for open vs. tubular microdiscectomy, insurance coverage, and recovery benefit…","Microdiscectomy Surgery Cost in Hyderabad","https://www.drsayuj.info/services/microdiscectomy-surgery-cost-hyderabad","index, follow",847
/services/minimally-invasive-spine-surgery,200,"Minimally Invasive Spine Surgery Hyderabad | Day Care","Advanced endoscopic spine surgery in Hyderabad. Tiny incision, no muscle cutting, same-day discharge. Expert care by Dr. Sayuj Krishnan. Get Cost Estimate.","Endoscopic &amp; Minimally Invasive Spine Surgery Hyderabad","https://www.drsayuj.info/services/minimally-invasive-spine-surgery","index, follow",2462
/services/peripheral-nerve-surgery,200,"Peripheral Nerve Surgery Hyderabad | Carpal &amp; Ulnar","Day-care carpal tunnel, ulnar decompression, and nerve repair by Dr. Sayuj Krishnan at Yashoda Hospital Malakpet.","Peripheral Nerve Surgery","https://www.drsayuj.info/services/peripheral-nerve-surgery","index, follow",1074
/services/peripheral-nerve-surgery-hyderabad,200,"Peripheral Nerve Surgery in Hyderabad | Carpal Tunnel Expert","Expert peripheral nerve surgery in Hyderabad. Minimally invasive treatment for Carpal Tunnel, Ulnar Nerve, and nerve tumors. Restore sensation &amp; strength.","Peripheral Nerve Surgery in Hyderabad","https://www.drsayuj.info/services/peripheral-nerve-surgery-hyderabad","index, follow",1527
/services/robotic-spine-surgery-hyderabad,200,"Robotic Spine Surgery Hyderabad | Dr. Sayuj Krishnan","Advanced robotic spine surgery in Hyderabad. High precision, minimal radiation, and faster recovery with AI-driven surgical planning at Yashoda Hospital.","Robotic Spine Surgery in Hyderabad","https://www.drsayuj.info/services/robotic-spine-surgery-hyderabad","index, follow",1117
/services/slip-disc-surgery-cost-hyderabad,200,"Slip Disc Surgery Cost in Hyderabad | Endoscopic Discectomy…","Complete guide to slip disc (herniated disc) surgery cost in Hyderabad. Endoscopic discectomy prices, insurance coverage, and payment options at Yashoda H…","Slip Disc Surgery Cost in Hyderabad","https://www.drsayuj.info/services/slip-disc-surgery-cost-hyderabad","index, follow",736
/services/spinal-decompression-surgery-hyderabad,200,"Spinal Decompression Surgery in Hyderabad | Cost &amp; Recovery…","Expert spinal decompression surgery by Dr. Sayuj Krishnan. Minimally invasive treatment for nerve compression, sciatica, and spinal stenosis. Check costs.","Spinal Decompression Surgery in Hyderabad","https://www.drsayuj.info/services/spinal-decompression-surgery-hyderabad","index, follow",1162
/services/spinal-fusion,200,"Spinal Fusion Surgery in Hyderabad | TLIF &amp; ACDF","TLIF and ACDF for instability, recovery timelines, and insurance support with Dr. Sayuj Krishnan.","Spinal Fusion Surgery (TLIF/ACDF)","https://www.drsayuj.info/services/spinal-fusion","index, follow",1110
/services/spinal-fusion-surgery-hyderabad,200,"Spinal Fusion Surgery Hyderabad","Expert spinal fusion surgery (TLIF/PLIF) by Dr. Sayuj Krishnan. Stabilization for spondylolisthesis and fractures. Minimally invasive screw fixation.","Spinal Fusion Surgery (TLIF/PLIF)","https://www.drsayuj.info/services/spinal-fusion-surgery-hyderabad","index, follow",1102
/services/spine-surgery-cost-hyderabad,200,"Spine Surgery Cost in Hyderabad 2025 | TESS, Fusion &amp; Impla…","Detailed spine surgery cost guide for Hyderabad. Endoscopic TESS (₹2.5L+), Microdiscectomy, and Implant prices (Indian vs Imported). Cashless Insurance ac…","Spine Surgery Cost in Hyderabad 2025 Price Guide","https://www.drsayuj.info/services/spine-surgery-cost-hyderabad","index, follow",1018
/services/spine-surgery-hyderabad,200,"Spine Surgery Hyderabad | Minimally Invasive Specialist","Minimally invasive spine surgery in Hyderabad. Walk the next day with keyhole endoscopic techniques for slip disc &amp; sciatica. Expert care at Yashoda.","Advanced Spine Surgery in Hyderabad","https://www.drsayuj.info/services/spine-surgery-hyderabad","index, follow",1117
/services/uniportal-endoscopic-spine-surgery-hyderabad,200,"Uniportal Endoscopic Spine Surgery Hyderabad | Single Hole…","Advanced Uniportal Endoscopic Spine Surgery (Single Hole) in Hyderabad by Dr. Sayuj Krishnan. True stitchless, minimally invasive spine surgery for slip d…","Uniportal Endoscopic Spine Surgery in Hyderabad","https://www.drsayuj.info/services/uniportal-endoscopic-spine-surgery-hyderabad","index, follow",1296
/spine-surgery,200,"Endoscopic Spine Surgery Hyderabad | Minimally Invasive Specialist","Expert endoscopic spine surgery in Hyderabad. Minimally invasive slip disc &amp; stenosis treatment. Same-day discharge. Dr. Sayuj Krishnan.","Endoscopic Spine Surgery in Hyderabad","https://www.drsayuj.info/spine-surgery","index, follow",1530
/stories/endoscopic-discectomy-same-day-hyderabad,200,"Same-Day Endoscopic Discectomy in Hyderabad — Case Story","De-identified story: severe sciatica treated with endoscopic discectomy and same-day discharge in Hyderabad. Recovery timeline and outcomes.","Same-Day Endoscopic Discectomy in Hyderabad — Case Story","https://www.drsayuj.info/stories/endoscopic-discectomy-same-day-hyderabad","index, follow",764
/stories/endoscopic-ulbd-stenosis-hyderabad,200,"Endoscopic ULBD for Lumbar Stenosis — Case Story (Hyderabad)","De-identified case: walking distance and leg pain improved after endoscopic ULBD for stenosis in Hyderabad. Recovery timeline and outcomes.","Endoscopic ULBD for Lumbar Stenosis — Case Story (Hyderabad)","https://www.drsayuj.info/stories/endoscopic-ulbd-stenosis-hyderabad","index, follow",714
/stories/mvd-trigeminal-neuralgia-hyderabad,200,"MVD for Trigeminal Neuralgia — Case Story (Hyderabad)","De-identified story: severe facial pain relieved after microvascular decompression in Hyderabad. Recovery and durability of pain relief.","MVD for Trigeminal Neuralgia — Case Story (Hyderabad)","https://www.drsayuj.info/stories/mvd-trigeminal-neuralgia-hyderabad","index, follow",726
/symptoms-checker,200,"Symptom Checker | Dr Sayuj Krishnan - AI-Powered Symptom Analysis","Use our AI-powered symptom checker to get preliminary guidance about your symptoms. Not a diagnosis - always consult with Dr. Sayuj for proper evaluation.","AI-Powered Symptom Checker","https://www.drsayuj.info/symptoms-checker","index, follow",535
/symptoms/back-pain,200,"Back Pain Symptoms &amp; Causes | When to See a Doctor | Dr Say…","Understanding back pain causes: muscle strain vs slip disc vs sciatica. Learn red flag symptoms requiring urgent neurosurgical attention in Hyderabad.","Back Pain: Symptoms, Causes &amp; When to Worry","https://www.drsayuj.info/symptoms/back-pain","index, follow",862
/symptoms/pain-on-top-of-head-causes,200,"Vertex Headache Causes | Pain on Top of Head (Hyderabad)","Causes of pain on top of the head (vertex headache), red flags, and when to see a neurosurgeon in Hyderabad.","Pain on Top of the Head — Causes &amp; Next Steps","https://www.drsayuj.info/symptoms/pain-on-top-of-head-causes","index, follow",1115
/symptoms/signs-of-brain-tumor,200,"Signs of Brain Tumor — When to Seek a Neurosurgeon in Hyderabad","Understand early warning signs, emergency red flags, and the diagnostic pathway for suspected brain tumours with Dr. Sayuj Krishnan in Hyderabad.","Signs of a Brain Tumor","https://www.drsayuj.info/symptoms/signs-of-brain-tumor","index, follow",984
/technology-facilities,200,"Advanced Technology &amp; Facilities | Dr. Sayuj Krishnan | State-of-the-Art Neurosurgery Equipment","Explore our cutting-edge neurosurgery technology including 3T MRI, neuronavigation, endoscopic systems, intraoperative monitoring, and AI-assisted surgical planning in Hyderabad.","Advanced Technology &amp; Facilities","https://www.drsayuj.info/technology-facilities/","index, follow",1005
/technology-innovation,200,"Advanced Neurosurgery Technology Hyderabad | AI, Robotics &amp; Safety","Experience safer spine &amp; brain surgery with AI-driven neuronavigation, ROSA Robotics, and real-time monitoring. Dr. Sayuj Krishnan uses advanced technology for precision &amp; faster recovery.","Advanced Technology &amp; Innovation","https://www.drsayuj.info/technology-innovation","index, follow",1278
/terms,200,"Terms of Service | Dr Sayuj Krishnan - Neurosurgeon in Hyderabad","Terms of service for Dr Sayuj Krishnan&#x27;s neurosurgical practice in Hyderabad. Read our terms and conditions for using our website and services.","Terms of Service","https://www.drsayuj.info/terms","index, follow",860