URL,Status,Title,Meta Description,H1,Word Count,Canonical,Robots,Schema Types
https://www.drsayuj.info/remotion-showcase,200,Video Showcase | Remotion Animations | Dr. Sayuj Krishnan,"Interactive video showcase featuring animated service highlights, outcome dashboards, patient testimonials, and blog reels — powered by Remotion for www.d…",Video Showcase,640,https://www.drsayuj.info/remotion-showcase,"index, follow",Place;CollegeOrUniversity;OpeningHoursSpecification;AggregateRating;MedicalSpecialty;State;BreadcrumbList;Hospital;ReserveAction;Offer;WebSite;MedicalService;Physician;PropertyValue;GeoCoordinates;Organization;City;PostalAddress;OfferCatalog;ListItem;EducationalOccupationalCredential;MedicalProcedure;Country
https://www.drsayuj.info/appointments?utm_source=site&utm_medium=cta&utm_campaign=nap_block,200,Book Appointment | Best Neurosurgeon Hyderabad,"Book Appointment with Dr. Sayuj Krishnan, the Best Neurosurgeon in Hyderabad. Schedule a consultation for Neurosurgery, Spine Surgery & Brain Tumor Surgery.",Book your consultation with;Dr. Sayuj Krishnan,527,https://www.drsayuj.info/appointments,"index, follow",Place;FAQPage;CollegeOrUniversity;OpeningHoursSpecification;AggregateRating;MedicalSpecialty;State;BreadcrumbList;Hospital;ReserveAction;Offer;MedicalWebPage;WebSite;MedicalAudience;MedicalService;Physician;PropertyValue;Question;GeoCoordinates;Organization;City;Answer;PostalAddress;Audience;MedicalClinic;OfferCatalog;ListItem;EducationalOccupationalCredential;AdministrativeArea;MedicalProcedure;Person;Country
https://www.drsayuj.info/blog/awake-craniotomy-guide,200,Awake Craniotomy Guide Hyderabad | Dr. Sayuj,"Why awake brain surgery is chosen, mapping process, recovery, and FAQs for Hyderabad patients.",Awake Craniotomy: A Patient Guide,1135,https://www.drsayuj.info/blog/awake-craniotomy-guide,"index, follow",BlogPosting;Place;FAQPage;MedicalCondition;CollegeOrUniversity;OpeningHoursSpecification;AggregateRating;MedicalSpecialty;State;BreadcrumbList;Hospital;ReserveAction;Offer;MedicalWebPage;WebSite;MedicalService;Physician;PropertyValue;Question;GeoCoordinates;Organization;City;Answer;PostalAddress;OfferCatalog;ListItem;EducationalOccupationalCredential;MedicalProcedure;Person;Country
https://www.drsayuj.info/services/peripheral-nerve-surgery,200,Peripheral Nerve Surgery Hyderabad | Carpal & Ulnar,"Day-care carpal tunnel, ulnar decompression, and nerve repair by Dr. Sayuj Krishnan at Yashoda Hospital Malakpet.",Peripheral Nerve Surgery,1077,https://www.drsayuj.info/services/peripheral-nerve-surgery,"index, follow",Place;FAQPage;MedicalCondition;CollegeOrUniversity;OpeningHoursSpecification;AggregateRating;MedicalSpecialty;State;BreadcrumbList;Hospital;ReserveAction;Offer;MedicalWebPage;WebSite;MedicalService;Physician;PropertyValue;Question;GeoCoordinates;Organization;City;Answer;PostalAddress;OfferCatalog;ListItem;EducationalOccupationalCredential;MedicalProcedure;Country
https://www.drsayuj.info/conditions/brain-tumor-symptoms-hyderabad,200,Brain Tumor Symptoms Hyderabad | Diagnosis & Treatment,"Comprehensive guide to brain tumor symptoms, diagnosis, and care options. Learn about warning signs and expert diagnosis in Hyderabad.",Brain Tumor Symptoms & Diagnosis in Hyderabad,1049,https://www.drsayuj.info/conditions/brain-tumor-symptoms-hyderabad,"index, follow",Place;FAQPage;MedicalCondition;CollegeOrUniversity;OpeningHoursSpecification;AggregateRating;MedicalSpecialty;State;BreadcrumbList;Hospital;ReserveAction;Offer;MedicalWebPage;WebSite;MedicalService;Physician;PropertyValue;Question;GeoCoordinates;Organization;City;Answer;PostalAddress;OfferCatalog;ListItem;EducationalOccupationalCredential;MedicalProcedure;Country
https://www.drsayuj.info/locations/neurosurgeon-dilsukhnagar,200,"Neurosurgeon near Dilsukhnagar, Hyderabad | Dr Sayuj Krishnan",Expert neurosurgeon near Dilsukhnagar. Dr Sayuj Krishnan is just 5 minutes away at Yashoda Malakpet. Advanced spine & brain care.,Best Neurosurgeon Near Dilsukhnagar,651,https://www.drsayuj.info/locations/neurosurgeon-dilsukhnagar,"index, follow",Place;FAQPage;CollegeOrUniversity;OpeningHoursSpecification;AggregateRating;MedicalSpecialty;State;BreadcrumbList;Hospital;ReserveAction;Offer;WebSite;MedicalService;Physician;PropertyValue;Question;GeoCoordinates;Organization;City;Answer;PostalAddress;MedicalClinic;OfferCatalog;ListItem;EducationalOccupationalCredential;MedicalProcedure;Country
https://www.drsayuj.info/locations/neurosurgeon-vanasthalipuram,200,"Neurosurgeon near Vanasthalipuram, Hyderabad | Dr Sayuj Krishnan","Expert neurosurgeon serving Vanasthalipuram. Dr Sayuj Krishnan is located at Yashoda Malakpet, accessible via NH65. Advanced spine & brain care.",Best Neurosurgeon Near Vanasthalipuram,644,https://www.drsayuj.info/locations/neurosurgeon-vanasthalipuram,"index, follow",Place;FAQPage;CollegeOrUniversity;OpeningHoursSpecification;AggregateRating;MedicalSpecialty;State;BreadcrumbList;Hospital;ReserveAction;Offer;WebSite;MedicalService;Physician;PropertyValue;Question;GeoCoordinates;Organization;City;Answer;PostalAddress;MedicalClinic;OfferCatalog;ListItem;EducationalOccupationalCredential;MedicalProcedure;Country
https://www.drsayuj.info/locations/neurosurgeon-miyapur,200,"Neurosurgeon near Miyapur, Hyderabad | Dr Sayuj Krishnan",Expert neurosurgeon near Miyapur. Dr Sayuj Krishnan provides advanced brain and spine surgery. Convenient access via Metro and NH65.,"Neurosurgeon Near Miyapur, Hyderabad",578,https://www.drsayuj.info/locations/neurosurgeon-miyapur,"index, follow",Place;FAQPage;CollegeOrUniversity;OpeningHoursSpecification;AggregateRating;MedicalSpecialty;State;BreadcrumbList;Hospital;ReserveAction;Offer;WebSite;MedicalService;Physician;PropertyValue;Question;GeoCoordinates;Organization;City;Answer;PostalAddress;MedicalClinic;OfferCatalog;ListItem;EducationalOccupationalCredential;MedicalProcedure;Country
https://www.drsayuj.info/locations/neurosurgeon-uppal,200,"Neurosurgeon near Uppal, Hyderabad | Dr Sayuj Krishnan",Expert neurosurgeon near Uppal. Dr Sayuj Krishnan provides advanced brain and spine surgery. Convenient access to Yashoda Malakpet.,"Neurosurgeon Near Uppal, Hyderabad",561,https://www.drsayuj.info/locations/neurosurgeon-uppal,"index, follow",Place;FAQPage;CollegeOrUniversity;OpeningHoursSpecification;AggregateRating;MedicalSpecialty;State;BreadcrumbList;Hospital;ReserveAction;Offer;WebSite;MedicalService;Physician;PropertyValue;Question;GeoCoordinates;Organization;City;Answer;PostalAddress;MedicalClinic;OfferCatalog;ListItem;EducationalOccupationalCredential;MedicalProcedure;Country
https://www.drsayuj.info/ai-chat,200,AI Chat Assistant | Book Appointment with Dr Sayuj Krishnan,"Chat with our AI assistant to book an appointment with Dr Sayuj Krishnan. Get instant help with symptoms, emergency detection, and appointment scheduling.",🤖 AI Chat Assistant,656,https://www.drsayuj.info/ai-chat,"index, follow",Place;CollegeOrUniversity;OpeningHoursSpecification;AggregateRating;MedicalSpecialty;State;BreadcrumbList;Hospital;ReserveAction;Offer;WebSite;MedicalService;Physician;PropertyValue;GeoCoordinates;Organization;City;PostalAddress;OfferCatalog;ListItem;EducationalOccupationalCredential;MedicalProcedure;Country
https://www.drsayuj.info/services/cervical-endoscopic-spine-surgery-hyderabad,200,Cervical Endoscopic Spine Surgery Hyderabad | Dr Sayuj,"Advanced cervical endoscopic spine surgery in Hyderabad. Treat neck pain and radiculopathy with keyhole surgery. Fast recovery, no fusion.",Cervical Endoscopic Spine Surgery in Hyderabad,1135,https://www.drsayuj.info/services/cervical-endoscopic-spine-surgery-hyderabad,"index, follow",Place;FAQPage;CollegeOrUniversity;OpeningHoursSpecification;AggregateRating;MedicalSpecialty;State;BreadcrumbList;Hospital;ReserveAction;Offer;WebSite;MedicalService;Physician;PropertyValue;Question;GeoCoordinates;Organization;City;Answer;PostalAddress;OfferCatalog;ListItem;EducationalOccupationalCredential;MedicalProcedure;Country
https://www.drsayuj.info/services/cervical-disc-replacement-hyderabad,200,Cervical Disc Replacement Surgery Hyderabad | Artificial Di…,Expert cervical disc replacement (ADR) by Dr. Sayuj Krishnan. Motion-preserving alternative to fusion for cervical spondylosis & neck pain.,Cervical Disc Replacement Surgery (ADR),1079,https://www.drsayuj.info/services/cervical-disc-replacement-hyderabad,"index, follow",Place;FAQPage;CollegeOrUniversity;OpeningHoursSpecification;AggregateRating;MedicalSpecialty;State;BreadcrumbList;Hospital;ReserveAction;Offer;WebSite;MedicalService;Physician;PropertyValue;Question;GeoCoordinates;Organization;City;Answer;PostalAddress;OfferCatalog;ListItem;EducationalOccupationalCredential;MedicalProcedure;Country
https://www.drsayuj.info/conditions/a-z/acoustic-neuroma,200,Acoustic Neuroma Treatment in Hyderabad | Dr. Sayuj Krishnan,Hearing-preserving microsurgery and radiosurgery options for vestibular schwannoma causing imbalance or tinnitus.,Acoustic Neuroma,577,https://www.drsayuj.info/conditions/acoustic-neuroma-treatment-hyderabad,"index, follow",Place;FAQPage;MedicalCondition;CollegeOrUniversity;OpeningHoursSpecification;AggregateRating;MedicalSpecialty;State;BreadcrumbList;Hospital;ReserveAction;Offer;WebSite;MedicalService;Physician;PropertyValue;Question;GeoCoordinates;Organization;City;Answer;PostalAddress;OfferCatalog;ListItem;EducationalOccupationalCredential;MedicalProcedure;Country;MedicalTherapy;MedicalSignOrSymptom
https://www.drsayuj.info/conditions/a-z/brachial-plexus,200,Brachial Plexus Injury Treatment | Dr. Sayuj Krishnan,"Microsurgical nerve reconstruction and rehabilitation for traumatic upper limb nerve injuries. Expert treatment by Dr. Sayuj Krishnan in Hyderabad. Learn about symptoms, treatment options, and recovery.",Brachial Plexus Injury,512,https://www.drsayuj.info/services/peripheral-nerve-surgery-hyderabad,"noindex, follow",Place;FAQPage;MedicalCondition;CollegeOrUniversity;OpeningHoursSpecification;AggregateRating;MedicalSpecialty;State;BreadcrumbList;Hospital;ReserveAction;Offer;WebSite;MedicalService;Physician;PropertyValue;Question;GeoCoordinates;Organization;City;Answer;PostalAddress;OfferCatalog;ListItem;EducationalOccupationalCredential;MedicalProcedure;Country;MedicalTherapy;MedicalSignOrSymptom
https://www.drsayuj.info/conditions/a-z/aneurysm,200,Brain Aneurysm Treatment in Hyderabad | Dr. Sayuj Krishnan,Emergency evaluation and microsurgical or endovascular strategies for ruptured and unruptured aneurysms.,Brain Aneurysm,604,https://www.drsayuj.info/conditions/brain-aneurysm-treatment-hyderabad,"index, follow",Place;FAQPage;MedicalCondition;CollegeOrUniversity;OpeningHoursSpecification;AggregateRating;MedicalSpecialty;State;BreadcrumbList;Hospital;ReserveAction;Offer;WebSite;MedicalService;Physician;PropertyValue;Question;GeoCoordinates;Organization;City;Answer;PostalAddress;OfferCatalog;ListItem;EducationalOccupationalCredential;MedicalProcedure;Country;MedicalTherapy;MedicalSignOrSymptom
https://www.drsayuj.info/conditions/a-z/brain-tumor,200,Brain Tumor Treatment | Dr. Sayuj Krishnan,"Advanced neuronavigation-guided resections for benign and malignant tumours with functional preservation. Expert treatment by Dr. Sayuj Krishnan in Hyderabad. Learn about symptoms, treatment options, and recovery.",Brain Tumor,620,https://www.drsayuj.info/services/brain-tumor-surgery-hyderabad,"noindex, follow",Place;FAQPage;MedicalCondition;CollegeOrUniversity;OpeningHoursSpecification;AggregateRating;MedicalSpecialty;State;BreadcrumbList;Hospital;ReserveAction;Offer;WebSite;MedicalService;Physician;PropertyValue;Question;GeoCoordinates;Organization;City;Answer;PostalAddress;OfferCatalog;ListItem;EducationalOccupationalCredential;MedicalProcedure;Country;MedicalTherapy;MedicalSignOrSymptom
https://www.drsayuj.info/patient-stories/minimal-invasive-meningioma-resection,200,Back to Work After Meningioma Surgery | Patient Success Sto…,A 39-year-old teacher with progressive word-finding difficulty underwent awake craniotomy with mapping. She returned to the classroom in four weeks with n…,Back to Work After Meningioma Surgery,607,https://www.drsayuj.info/patient-stories/minimal-invasive-meningioma-resection,"index, follow",Place;CollegeOrUniversity;OpeningHoursSpecification;AggregateRating;MedicalSpecialty;State;BreadcrumbList;Hospital;ReserveAction;Offer;WebSite;MedicalService;Physician;PropertyValue;GeoCoordinates;Organization;City;Article;PostalAddress;OfferCatalog;WebPage;ListItem;EducationalOccupationalCredential;MedicalProcedure;Person;Country
https://www.drsayuj.info/conditions/a-z/brain-tumor-symptoms,200,Brain Tumor Symptoms Treatment | Dr. Sayuj Krishnan,"Recognize early warning signs like persistent headaches, seizures, and vision changes. Early detection saves lives. Expert treatment by Dr. Sayuj Krishnan in Hyderabad. Learn about symptoms, treatment options, and recovery.",Brain Tumor Symptoms,544,https://www.drsayuj.info/symptoms/signs-of-brain-tumor,"noindex, follow",Place;MedicalCondition;CollegeOrUniversity;OpeningHoursSpecification;AggregateRating;MedicalSpecialty;State;BreadcrumbList;Hospital;ReserveAction;Offer;WebSite;MedicalService;Physician;PropertyValue;GeoCoordinates;Organization;City;PostalAddress;OfferCatalog;ListItem;EducationalOccupationalCredential;MedicalProcedure;Country;MedicalTherapy;MedicalSignOrSymptom
https://www.drsayuj.info/conditions/a-z/carpal-tunnel,200,Carpal Tunnel Syndrome Treatment in Hyderabad | Dr. Sayuj K…,Day-care minimally invasive decompression for wrist nerve compression with rapid functional recovery.,Carpal Tunnel Syndrome,586,https://www.drsayuj.info/conditions/carpal-tunnel-syndrome-hyderabad,"index, follow",Place;FAQPage;MedicalCondition;CollegeOrUniversity;OpeningHoursSpecification;AggregateRating;MedicalSpecialty;State;BreadcrumbList;Hospital;ReserveAction;Offer;WebSite;MedicalService;Physician;PropertyValue;Question;GeoCoordinates;Organization;City;Answer;PostalAddress;OfferCatalog;ListItem;EducationalOccupationalCredential;MedicalProcedure;Country;MedicalTherapy;MedicalSignOrSymptom
https://www.drsayuj.info/patient-stories/carpal-tunnel-day-care-success,200,Grip Strength Back After Carpal Tunnel Release | Patient Su…,A 44-year-old designer with severe median nerve compression underwent day-care release. Strength training and ergonomic coaching restored productivity in…,Grip Strength Back After Carpal Tunnel Release,603,https://www.drsayuj.info/patient-stories/carpal-tunnel-day-care-success,"index, follow",Place;CollegeOrUniversity;OpeningHoursSpecification;AggregateRating;MedicalSpecialty;State;BreadcrumbList;Hospital;ReserveAction;Offer;WebSite;MedicalService;Physician;PropertyValue;GeoCoordinates;Organization;City;Article;PostalAddress;OfferCatalog;WebPage;ListItem;EducationalOccupationalCredential;MedicalProcedure;Person;Country
https://www.drsayuj.info/conditions/a-z/cervical-disc,200,Cervical Radiculopathy Treatment Hyderabad | Pinched Nerve Surgery,Expert treatment for cervical radiculopathy (pinched nerve) in Hyderabad. Keyhole surgery (Foraminotomy) and ACDF by Dr. Sayuj Krishnan.,Cervical Radiculopathy (Pinched Nerve) Treatment in Hyderabad,1371,https://www.drsayuj.info/conditions/cervical-radiculopathy-treatment-hyderabad,"index, follow",Place;FAQPage;MedicalCondition;CollegeOrUniversity;OpeningHoursSpecification;AggregateRating;MedicalSpecialty;State;BreadcrumbList;Hospital;ReserveAction;Offer;MedicalWebPage;WebSite;MedicalService;Physician;PropertyValue;Question;GeoCoordinates;Organization;City;Answer;PostalAddress;MedicalClinic;OfferCatalog;ListItem;EducationalOccupationalCredential;MedicalProcedure;Country
https://www.drsayuj.info/conditions/a-z/cervical-myelopathy,200,Cervical Myelopathy Treatment | Dr. Sayuj Krishnan,"Decompression and stabilisation strategies for cervical spinal cord compression leading to gait disturbance. Expert treatment by Dr. Sayuj Krishnan in Hyderabad. Learn about symptoms, treatment options, and recovery.",Cervical Myelopathy,522,https://www.drsayuj.info/services/minimally-invasive-spine-surgery,"noindex, follow",Place;MedicalCondition;CollegeOrUniversity;OpeningHoursSpecification;AggregateRating;MedicalSpecialty;State;BreadcrumbList;Hospital;ReserveAction;Offer;WebSite;MedicalService;Physician;PropertyValue;GeoCoordinates;Organization;City;PostalAddress;OfferCatalog;ListItem;EducationalOccupationalCredential;MedicalProcedure;Country;MedicalTherapy;MedicalSignOrSymptom
https://www.drsayuj.info/conditions/a-z/chiari-malformation,200,Chiari Malformation Treatment in Hyderabad | Dr. Sayuj Kris…,Posterior fossa decompression planning for craniovertebral junction disorders causing headaches and imbalance.,Chiari Malformation,533,https://www.drsayuj.info/conditions/chiari-malformation-hyderabad,"index, follow",Place;MedicalCondition;CollegeOrUniversity;OpeningHoursSpecification;AggregateRating;MedicalSpecialty;State;BreadcrumbList;Hospital;ReserveAction;Offer;WebSite;MedicalService;Physician;PropertyValue;GeoCoordinates;Organization;City;PostalAddress;OfferCatalog;ListItem;EducationalOccupationalCredential;MedicalProcedure;Country;MedicalTherapy;MedicalSignOrSymptom
https://www.drsayuj.info/conditions/a-z/degenerative-disc-disease,200,Degenerative Disc Disease Treatment | Dr. Sayuj Krishnan,"Age-related disc wear causing chronic back or neck pain managed with conservative and minimally invasive techniques. Expert treatment by Dr. Sayuj Krishnan in Hyderabad. Learn about symptoms, treatment options, and recovery.",Degenerative Disc Disease,517,https://www.drsayuj.info/disease-guides/degenerative-disc-disease,"noindex, follow",Place;MedicalCondition;CollegeOrUniversity;OpeningHoursSpecification;AggregateRating;MedicalSpecialty;State;BreadcrumbList;Hospital;ReserveAction;Offer;WebSite;MedicalService;Physician;PropertyValue;GeoCoordinates;Organization;City;PostalAddress;OfferCatalog;ListItem;EducationalOccupationalCredential;MedicalProcedure;Country;MedicalTherapy;MedicalSignOrSymptom
https://www.drsayuj.info/disease-guides/degenerative-disc-disease,200,"Degenerative Disc Disease: Symptoms, Causes & Treatment | Dr. Sayuj Krishnan","Comprehensive guide to degenerative disc disease: symptoms, causes, diagnosis, and treatment options including endoscopic discectomy in Hyderabad.",Degenerative Disc Disease,1010,https://www.drsayuj.info/disease-guides/degenerative-disc-disease/,"index, follow",Place;MedicalCondition;CollegeOrUniversity;OpeningHoursSpecification;AggregateRating;MedicalSpecialty;State;BreadcrumbList;Hospital;ReserveAction;Offer;AnatomicalStructure;WebSite;MedicalService;Physician;PropertyValue;GeoCoordinates;Organization;City;PostalAddress;OfferCatalog;ListItem;EducationalOccupationalCredential;MedicalProcedure;Country
https://www.drsayuj.info/conditions/a-z/disc-herniation,200,Disc Herniation (Lumbar) Treatment in Hyderabad | Dr. Sayuj…,Full endoscopic discectomy and rehabilitation pathways for sciatic pain caused by lumbar disc prolapse.,Disc Herniation (Lumbar),580,https://www.drsayuj.info/conditions/herniated-disc-treatment-hyderabad,"index, follow",Place;FAQPage;MedicalCondition;CollegeOrUniversity;OpeningHoursSpecification;AggregateRating;MedicalSpecialty;State;BreadcrumbList;Hospital;ReserveAction;Offer;WebSite;MedicalService;Physician;PropertyValue;Question;GeoCoordinates;Organization;City;Answer;PostalAddress;OfferCatalog;ListItem;EducationalOccupationalCredential;MedicalProcedure;Country;MedicalTherapy;MedicalSignOrSymptom
https://www.drsayuj.info/conditions/a-z/epilepsy,200,Drug-Resistant Epilepsy Treatment | Dr. Sayuj Krishnan,"Comprehensive seizure evaluation, stereo-EEG planning, and epilepsy surgery for medication-resistant cases. Expert treatment by Dr. Sayuj Krishnan in Hyderabad. Learn about symptoms, treatment options, and recovery.",Drug-Resistant Epilepsy,564,https://www.drsayuj.info/services/epilepsy-surgery-hyderabad,"noindex, follow",Place;FAQPage;MedicalCondition;CollegeOrUniversity;OpeningHoursSpecification;AggregateRating;MedicalSpecialty;State;BreadcrumbList;Hospital;ReserveAction;Offer;WebSite;MedicalService;Physician;PropertyValue;Question;GeoCoordinates;Organization;City;Answer;PostalAddress;OfferCatalog;ListItem;EducationalOccupationalCredential;MedicalProcedure;Country;MedicalTherapy;MedicalSignOrSymptom
https://www.drsayuj.info/patient-stories/temporal-lobe-epilepsy-control,200,Seizure-Free After Epilepsy Surgery | Patient Success Story…,A 27-year-old software engineer with weekly seizures despite triple therapy underwent comprehensive evaluation followed by resection. He is seizure-free a…,Seizure-Free After Epilepsy Surgery,610,https://www.drsayuj.info/patient-stories/temporal-lobe-epilepsy-control,"index, follow",Place;CollegeOrUniversity;OpeningHoursSpecification;AggregateRating;MedicalSpecialty;State;BreadcrumbList;Hospital;ReserveAction;Offer;WebSite;MedicalService;Physician;PropertyValue;GeoCoordinates;Organization;City;Article;PostalAddress;OfferCatalog;WebPage;ListItem;EducationalOccupationalCredential;MedicalProcedure;Person;Country
https://www.drsayuj.info/conditions/a-z/glioma,200,Glioma Treatment | Dr. Sayuj Krishnan,"Oncologic neurosurgery combining awake mapping and adjuvant therapies for high-grade and low-grade gliomas. Expert treatment by Dr. Sayuj Krishnan in Hyderabad. Learn about symptoms, treatment options, and recovery.",Glioma,485,https://www.drsayuj.info/services/brain-tumor-surgery-hyderabad,"noindex, follow",Place;MedicalCondition;CollegeOrUniversity;OpeningHoursSpecification;AggregateRating;MedicalSpecialty;State;BreadcrumbList;Hospital;ReserveAction;Offer;WebSite;MedicalService;Physician;PropertyValue;GeoCoordinates;Organization;City;PostalAddress;OfferCatalog;ListItem;EducationalOccupationalCredential;MedicalProcedure;Country;MedicalTherapy;MedicalSignOrSymptom
https://www.drsayuj.info/conditions/a-z/hydrocephalus,200,Hydrocephalus Treatment | Dr. Sayuj Krishnan,"Endoscopic third ventriculostomy and shunt management for cerebrospinal fluid circulation disorders. Expert treatment by Dr. Sayuj Krishnan in Hyderabad. Learn about symptoms, treatment options, and recovery.",Hydrocephalus,516,https://www.drsayuj.info/services/brain-tumor-surgery-hyderabad,"noindex, follow",Place;FAQPage;MedicalCondition;CollegeOrUniversity;OpeningHoursSpecification;AggregateRating;MedicalSpecialty;State;BreadcrumbList;Hospital;ReserveAction;Offer;WebSite;MedicalService;Physician;PropertyValue;Question;GeoCoordinates;Organization;City;Answer;PostalAddress;OfferCatalog;ListItem;EducationalOccupationalCredential;MedicalProcedure;Country;MedicalTherapy;MedicalSignOrSymptom
https://www.drsayuj.info/conditions/a-z/lumbar-stenosis,200,Spinal Stenosis Treatment Hyderabad | Walking Pain Relief,Can't walk more than 10 mins? Expert Lumbar Canal Stenosis treatment in Hyderabad. Micro-Decompression surgery for leg pain & heaviness. Dr Sayuj.,Lumbar Canal Stenosis Treatment in Hyderabad,1247,https://www.drsayuj.info/conditions/spinal-stenosis-treatment-hyderabad,"index, follow",Place;FAQPage;MedicalCondition;CollegeOrUniversity;OpeningHoursSpecification;AggregateRating;MedicalSpecialty;State;Hospital;ReserveAction;Offer;AnatomicalStructure;WebSite;MedicalService;Physician;PropertyValue;Question;GeoCoordinates;Organization;City;Answer;PostalAddress;OfferCatalog;EducationalOccupationalCredential;MedicalProcedure;Country;MedicalTherapy
https://www.drsayuj.info/conditions/a-z/meningioma,200,Meningioma Treatment | Dr. Sayuj Krishnan,"Skull base tumour management with neuronavigation, ultrasonic aspirators, and neuro-monitoring support. Expert treatment by Dr. Sayuj Krishnan in Hyderabad. Learn about symptoms, treatment options, and recovery.",Meningioma,499,https://www.drsayuj.info/services/brain-tumor-surgery-hyderabad,"noindex, follow",Place;MedicalCondition;CollegeOrUniversity;OpeningHoursSpecification;AggregateRating;MedicalSpecialty;State;BreadcrumbList;Hospital;ReserveAction;Offer;WebSite;MedicalService;Physician;PropertyValue;GeoCoordinates;Organization;City;PostalAddress;OfferCatalog;ListItem;EducationalOccupationalCredential;MedicalProcedure;Country;MedicalTherapy;MedicalSignOrSymptom
https://www.drsayuj.info/conditions/a-z/metastasis,200,Metastatic Brain Lesions Treatment | Dr. Sayuj Krishnan,"Surgical and radiosurgical coordination for metastatic brain disease with multidisciplinary oncology input. Expert treatment by Dr. Sayuj Krishnan in Hyderabad. Learn about symptoms, treatment options, and recovery.",Metastatic Brain Lesions,474,https://www.drsayuj.info/services/brain-tumor-surgery-hyderabad,"noindex, follow",Place;MedicalCondition;CollegeOrUniversity;OpeningHoursSpecification;AggregateRating;MedicalSpecialty;State;BreadcrumbList;Hospital;ReserveAction;Offer;WebSite;MedicalService;Physician;PropertyValue;GeoCoordinates;Organization;City;PostalAddress;OfferCatalog;ListItem;EducationalOccupationalCredential;MedicalProcedure;Country;MedicalTherapy;MedicalSignOrSymptom
https://www.drsayuj.info/conditions/a-z/normal-pressure-hydrocephalus,200,Normal Pressure Hydrocephalus Treatment | Dr. Sayuj Krishnan,"Triad of gait disturbance, cognitive decline, and urinary issues treated with programmable shunt systems. Expert treatment by Dr. Sayuj Krishnan in Hyderabad. Learn about symptoms, treatment options, and recovery.",Normal Pressure Hydrocephalus,488,https://www.drsayuj.info/services/brain-tumor-surgery-hyderabad,"noindex, follow",Place;MedicalCondition;CollegeOrUniversity;OpeningHoursSpecification;AggregateRating;MedicalSpecialty;State;BreadcrumbList;Hospital;ReserveAction;Offer;WebSite;MedicalService;Physician;PropertyValue;GeoCoordinates;Organization;City;PostalAddress;OfferCatalog;ListItem;EducationalOccupationalCredential;MedicalProcedure;Country;MedicalTherapy;MedicalSignOrSymptom
