Path,Status,Title,Description,H1,Canonical,Robots,WordCount
/,200,"Best Neurosurgeon Hyderabad | Spine &amp; Brain Specialist","Top-rated neurosurgeon in Hyderabad (Yashoda Hospital). Expert in endoscopic spine surgery, brain tumors &amp; sciatica. Book appointment now.","Dr. Sayuj Krishnan: German-Trained Neurosurgeon in HyderabadMinimally invasive spine, awake brain surgery, and ROSA DBS at Yashoda Hospital, Malakpet.","https://www.drsayuj.info","index, follow",2197
/about,200,"About Dr. Sayuj Krishnan | Premier Neurosurgeon in Hyderabad | Credentials &amp; Experience","Learn about Dr. Sayuj Krishnan&#x27;s exceptional training, over 9 years of neurosurgical experience, German fellowship, and pioneering work in minimally invasive brain &amp; spine surgery in Hyderabad.","About Dr. Sayuj Krishnan","https://www.drsayuj.info/about","index, follow",1273
/appointments,200,"Book Appointment | Best Neurosurgeon Hyderabad | Dr. Sayuj","Book Appointment with Dr. Sayuj Krishnan, the Best Neurosurgeon in Hyderabad. Schedule a consultation for spine surgery &amp; brain tumor surgery.","Book your consultation withDr. Sayuj Krishnan","https://www.drsayuj.info/appointments","index, follow",532
/best-neurosurgeon-in-hyderabad,200,"Best Neurosurgeon in Hyderabad | Dr. Sayuj Krishnan","German-trained neurosurgeon at Yashoda Malakpet with 1,000+ endoscopic brain &amp; spine cases. Consultations available.","Best Neurosurgeon in Hyderabad — Evidence-Based Brain &amp; Spine Care","https://www.drsayuj.info/best-neurosurgeon-in-hyderabad/","index, follow",1255
/blog,200,"Blog | Dr Sayuj Krishnan - Neurosurgery Insights","Latest insights, research, and updates in neurosurgery from Dr Sayuj Krishnan. Expert articles on brain and spine conditions, treatments, and innovations.","Neurosurgery Blog","https://www.drsayuj.info/blog","index, follow",2067
/blog/awake-craniotomy-guide,200,"Awake Craniotomy Guide Hyderabad | Dr. Sayuj","Why awake brain surgery is chosen, mapping process, recovery, and FAQs for Hyderabad patients.","Awake Craniotomy: A Patient Guide","https://www.drsayuj.info/blog/awake-craniotomy-guide","index, follow",1132
/blog/brain-tumor-surgery-cost-hyderabad,200,"Brain Tumor Surgery Cost Hyderabad | Transparent Pricing","Brain tumor surgery cost breakdown, insurance coverage, and payment options with Dr. Sayuj Krishnan at Yashoda Hospital Malakpet.","Brain Tumor Surgery Cost Hyderabad | Transparent Pricing","https://www.drsayuj.info/blog/brain-tumor-surgery-cost-hyderabad","index, follow",1006
/blog/day-care-endoscopic-spine-surgery-eligibility,200,"Day-Care Spine Surgery Eligibility | When Can You Go Home S…","Criteria, safety protocols, and planning tips for same-day endoscopic spine surgery discharge in Hyderabad.","Day-Care Spine Surgery: Are You a Candidate for Same-Day Discharge?","https://www.drsayuj.info/blog/day-care-endoscopic-spine-surgery-eligibility/","index, follow",1812
/blog/day-care-spine-surgery-insurance-hyderabad,200,"Day-Care Spine Surgery Insurance Hyderabad | Coverage Guide","Day-care spine surgery insurance coverage, pre-authorization, and cashless treatment options with Dr. Sayuj Krishnan at Yashoda Hospital Malakpet.","Day-Care Spine Surgery Insurance Hyderabad | Coverage Guide","https://www.drsayuj.info/blog/day-care-spine-surgery-insurance-hyderabad","index, follow",1103
/blog/disc-replacement-vs-fusion,200,"Disc Replacement vs Fusion Hyderabad","Compare disc replacement vs spinal fusion: benefits, risks, recovery, and candidacy with Dr. Sayuj Krishnan in Hyderabad.","Disc Replacement vs Spinal Fusion: Making the Right Choice","https://www.drsayuj.info/blog/disc-replacement-vs-fusion","index, follow",1204
/blog/does-endoscopic-spine-surgery-work-for-sciatica-hyderabad,200,"Does Endoscopic Spine Surgery Work for Sciatica? (Hyderabad…","Does endoscopic spine surgery work for sciatica? Learn about its 90% success rate, same-day recovery, and safety benefits. Expert guide by Dr. Sayuj.","Does Endoscopic Spine Surgery Work for Sciatica? (Hyderabad Guide)","https://www.drsayuj.info/blog/does-endoscopic-spine-surgery-work-for-sciatica-hyderabad/","index, follow",1182
/blog/endoscopic-cervical-spine-surgery-hyderabad,200,"Endoscopic Cervical Spine Surgery in Hyderabad | Recovery &amp;…","When cervical endoscopic surgery is indicated, benefits vs. fusion, recovery timelines, and safety considerations for patients in Hyderabad.","Endoscopic Cervical Spine Surgery in Hyderabad: When It’s Recommended and What to Expect","https://www.drsayuj.info/blog/endoscopic-cervical-spine-surgery-hyderabad/","index, follow",801
/blog/endoscopic-discectomy-cost-hyderabad,200,"Endoscopic Discectomy Cost in Hyderabad | What to Expect","Breakdown of day-care eligibility, insurance coverage, and cost drivers for endoscopic discectomy in Hyderabad.","Endoscopic Discectomy Cost in Hyderabad: What Affects Your Estimate?","https://www.drsayuj.info/blog/endoscopic-discectomy-cost-hyderabad/","index, follow",1348
/blog/endoscopic-spine-surgery-cost-hyderabad,200,"Endoscopic Spine Surgery Cost in Hyderabad | What Affects P…","Cost drivers, insurance nuances, and day-care eligibility for endoscopic spine surgery in Hyderabad.","Endoscopic Spine Surgery Cost in Hyderabad: What Affects Your Final Bill","https://www.drsayuj.info/blog/endoscopic-spine-surgery-cost-hyderabad/","index, follow",1318
/blog/endoscopic-vs-microdiscectomy-hyderabad,200,"Endoscopic vs Microdiscectomy in Hyderabad | Which is Right…","Compare incision size, recovery, and candidacy for endoscopic discectomy versus microdiscectomy in Hyderabad.","Endoscopic vs Microdiscectomy: Choosing the Right Approach for Your Herniated Disc","https://www.drsayuj.info/blog/endoscopic-vs-microdiscectomy-hyderabad/","index, follow",1656
/blog/how-much-does-brain-surgery-cost-hyderabad,200,"How Much Does Brain Surgery Cost in Hyderabad? Complete Gui…","Complete guide to brain surgery costs in Hyderabad. Learn about pricing factors, insurance coverage, payment options, and cost breakdowns for different br…","How Much Does Brain Surgery Cost in Hyderabad?","https://www.drsayuj.info/blog/how-much-does-brain-surgery-cost-hyderabad/","index, follow",889
/blog/mvd-vs-radiosurgery-trigeminal-neuralgia,200,"MVD vs Radiosurgery vs Percutaneous for Trigeminal Neuralgi…","Side-by-side comparison of microvascular decompression, Gamma Knife radiosurgery, and percutaneous procedures for trigeminal neuralgia.","Trigeminal Neuralgia Treatment: MVD vs Radiosurgery vs Percutaneous Procedures","https://www.drsayuj.info/blog/mvd-vs-radiosurgery-trigeminal-neuralgia/","index, follow",1803
/blog/return-to-work-after-endoscopic-discectomy-hyderabad,200,"Return to Work After Endoscopic Discectomy in Hyderabad","Week-by-week recovery timelines, activity progression, and workplace planning after endoscopic discectomy in Hyderabad.","Return to Work After Endoscopic Discectomy in Hyderabad: A Practical Guide","https://www.drsayuj.info/blog/return-to-work-after-endoscopic-discectomy-hyderabad/","index, follow",1164
/blog/sciatica-pain-management-hyderabad,200,"Sciatica Pain Management in Hyderabad | Dr. Sayuj Krishnan","Comprehensive guide to sciatica pain management in Hyderabad. Learn about conservative treatments, when surgery is needed, and recovery expectations.","Sciatica Pain Management in Hyderabad: Complete Treatment Guide","https://www.drsayuj.info/blog/sciatica-pain-management-hyderabad","index, follow",1111
/blog/spinal-fusion-cost-hyderabad,200,"Spinal Fusion Cost Hyderabad | TLIF ACDF","Spinal fusion cost breakdown, insurance coverage, and payment options with Dr. Sayuj Krishnan at Yashoda Hospital Malakpet.","Spinal Fusion Cost Hyderabad | TLIF ACDF","https://www.drsayuj.info/blog/spinal-fusion-cost-hyderabad","index, follow",1077
/blog/spine-health-maintenance-hyderabad,200,"Spine Health Maintenance in Hyderabad | Dr. Sayuj Krishnan","Complete guide to maintaining spine health in Hyderabad. Learn exercises, lifestyle tips, and preventive measures for a healthy spine.","Spine Health Maintenance in Hyderabad: Your Complete Guide","https://www.drsayuj.info/blog/spine-health-maintenance-hyderabad","index, follow",1299
/blog/spine-surgery-recovery-timeline-hyderabad,200,"Spine Surgery Recovery Timeline | Dr. Sayuj Krishnan","Complete guide to spine surgery recovery timeline in Hyderabad. Learn what to expect after endoscopic spine surgery and recovery milestones.","Spine Surgery Recovery Timeline in Hyderabad: What to Expect","https://www.drsayuj.info/blog/spine-surgery-recovery-timeline-hyderabad","index, follow",1303
/blog/when-to-worry-about-back-pain-neurosurgeon-hyderabad,200,"When to Worry About Back Pain and See a Neurosurgeon in Hyderabad","Learn the red flags for back pain, how MRIs and nerve tests help diagnosis, and when early consultation can prevent nerve damage in Hyderabad.","When to Worry About Back Pain and See a Neurosurgeon in Hyderabad","https://www.drsayuj.info/blog/when-to-worry-about-back-pain-neurosurgeon-hyderabad/","index, follow",542
/blog/world-stroke-day-2025-hyderabad-stroke-code,200,"World Stroke Day 2025 Hyderabad | BE-FAST Action Plan","Hyderabad families: recognise stroke symptoms with BE-FAST, call 108, and learn Dr Sayuj Krishnan’s Stroke Code pathway, prevention tips, and rehab suppor…","World Stroke Day 2025: Recognize Stroke Fast, Act Faster (Hyderabad, India)","https://www.drsayuj.info/blog/world-stroke-day-2025-hyderabad-stroke-code/","index, follow",2252
/brain-surgery,200,"Brain Surgery Hyderabad | Awake Brain Surgery &amp; Brain Tumor Surgery | Dr. Sayuj Krishnan","Expert brain surgery in Hyderabad with Dr. Sayuj Krishnan. Specializing in awake brain surgery, brain tumor surgery, ROSA DBS, and advanced microsurgical techniques with neuronavigation.","Advanced Brain Surgery","https://www.drsayuj.info/brain-surgery","index, follow",1268
/conditions,200,"Neurological Conditions A–Z | Dr. Sayuj Krishnan","Browse an A–Z index of brain, spine, and nerve conditions treated by Dr. Sayuj Krishnan with links to detailed guides and treatment options.","Conditions We Treat – A to Z","https://www.drsayuj.info/conditions","index, follow",2147
/conditions/acoustic-neuroma-treatment-hyderabad,200,"Acoustic Neuroma Treatment in Hyderabad | Dr. Sayuj Krishnan","Hearing-preserving microsurgery and radiosurgery options for vestibular schwannoma causing imbalance or tinnitus.","Acoustic Neuroma","https://www.drsayuj.info/conditions/acoustic-neuroma-treatment-hyderabad","index, follow",576
/conditions/brain-aneurysm-treatment-hyderabad,200,"Brain Aneurysm Treatment in Hyderabad | Dr. Sayuj Krishnan","Emergency evaluation and microsurgical or endovascular strategies for ruptured and unruptured aneurysms.","Brain Aneurysm","https://www.drsayuj.info/conditions/brain-aneurysm-treatment-hyderabad","index, follow",603
/conditions/brain-bleed-evacuation-hyderabad,200,"Emergency Brain Bleed Evacuation Hyderabad | Intracerebral Hemorrhage Surgery | Dr. Sayuj Krishnan","24/7 emergency endoscopic and microsurgical brain bleed evacuation in Hyderabad. Expert treatment for intracerebral hemorrhage, subdural hematoma, and epidural hematoma by Dr. Sayuj Krishnan at Yashoda Hospital.","Emergency Brain Bleed Evacuation in Hyderabad","https://www.drsayuj.info/conditions/brain-bleed-evacuation-hyderabad","index, follow",1317
/conditions/brain-tumor-surgery-hyderabad,200,"Brain Tumor Treatment Hyderabad | Diagnosis &amp; Care Options","Comprehensive guide to brain tumor diagnosis, treatment options, and recovery. Learn about microsurgery, radiosurgery, and expert care in Hyderabad.","Brain Tumor Surgery in Hyderabad","https://www.drsayuj.info/conditions/brain-tumor-surgery-hyderabad","index, follow",1209
/conditions/carpal-tunnel-syndrome-hyderabad,200,"Carpal Tunnel Syndrome Treatment in Hyderabad | Dr. Sayuj Krishnan","Day-care minimally invasive decompression for wrist nerve compression with rapid functional recovery.","Carpal Tunnel Syndrome","https://www.drsayuj.info/conditions/carpal-tunnel-syndrome-hyderabad","index, follow",587
/conditions/cervical-myelopathy-decompression-hyderabad,200,"Cervical Myelopathy Decompression Surgery Hyderabad | Endoscopic Spine Cord Decompression | Dr. Sayuj Krishnan","Expert treatment for cervical myelopathy with endoscopic and minimally invasive decompression surgery in Hyderabad. Specialized care for spinal cord compression by Dr. Sayuj Krishnan at Yashoda Hospital.","Cervical Myelopathy Decompression Surgery in Hyderabad","https://www.drsayuj.info/conditions/cervical-myelopathy-decompression-hyderabad","index, follow",1441
/conditions/cervical-radiculopathy-treatment-hyderabad,200,"Cervical Radiculopathy Treatment Hyderabad | Pinched Nerve Surgery","Expert treatment for cervical radiculopathy (pinched nerve) in Hyderabad. Keyhole surgery (Foraminotomy) and ACDF by Dr. Sayuj Krishnan.","Cervical Radiculopathy (Pinched Nerve) Treatment in Hyderabad","https://www.drsayuj.info/conditions/cervical-radiculopathy-treatment-hyderabad","index, follow",1368
/conditions/chiari-malformation-hyderabad,200,"Chiari Malformation Treatment in Hyderabad | Dr. Sayuj Krishnan","Posterior fossa decompression planning for craniovertebral junction disorders causing headaches and imbalance.","Chiari Malformation","https://www.drsayuj.info/conditions/chiari-malformation-hyderabad","index, follow",533
/conditions/degenerative-disc-disease-treatment-hyderabad,200,"Degenerative Disc Disease Treatment Hyderabad | Non-Surgical","Expert care for &#x27;Black Disc&#x27; &amp; lumbar degeneration. Dr. Sayuj uses advanced nerve blocks &amp; physiotherapy. 90% avoid surgery. Elderly-friendly protocols.","Degenerative Disc Disease Treatment Restoring Quality of Life","https://www.drsayuj.info/conditions/degenerative-disc-disease-treatment-hyderabad/","index, follow",1444
/conditions/herniated-disc-treatment-hyderabad,200,"Disc Herniation (Lumbar) Treatment in Hyderabad | Dr. Sayuj Krishnan","Full endoscopic discectomy and rehabilitation pathways for sciatic pain caused by lumbar disc prolapse.","Disc Herniation (Lumbar)","https://www.drsayuj.info/conditions/herniated-disc-treatment-hyderabad","index, follow",589
/conditions/osteoporotic-spine-fracture-hyderabad,200,"Osteoporotic Spine Fracture Treatment in Hyderabad | Verteb…","Expert treatment for Osteoporotic Compression Fractures. Minimally invasive Vertebroplasty &amp; Kyphoplasty (Cement Injection) by Dr. Sayuj Krishnan.","Osteoporotic Spine Fracture Treatment in Hyderabad","https://www.drsayuj.info/conditions/osteoporotic-spine-fracture-hyderabad/","index, follow",1081
/conditions/pituitary-adenoma-hyderabad,200,"Pituitary Adenoma Treatment in Hyderabad | Dr. Sayuj Krishnan","Endoscopic endonasal surgery for hormonal and vision-related pituitary tumours with endocrinology support.","Pituitary Adenoma","https://www.drsayuj.info/conditions/pituitary-adenoma-hyderabad","index, follow",543
/conditions/sciatica-pain-treatment-hyderabad,200,"Sciatica Treatment Hyderabad | 90% Non-Surgical | Dr Sayuj","Relief from Sciatica leg pain in Hyderabad. 90% non-surgical success with Dr. Sayuj Krishnan. Nerve blocks, Physio &amp; Endoscopic options. Book Consult.","Sciatica Treatment in Hyderabad Non-Surgical Relief First","https://www.drsayuj.info/conditions/sciatica-pain-treatment-hyderabad/","index, follow",1751
/conditions/scoliosis-treatment-hyderabad,200,"Scoliosis Treatment in Hyderabad | Spine Curvature Correcti…","Expert treatment for Scoliosis (Spine Deformity) by Dr. Sayuj Krishnan. Minimally invasive correction surgery costs and recovery in Hyderabad.","Scoliosis Treatment in Hyderabad","https://www.drsayuj.info/conditions/scoliosis-treatment-hyderabad/","index, follow",1183
/conditions/slip-disc-treatment-hyderabad,200,"Slip Disc Treatment in Hyderabad | Endoscopic Discectomy |…","Comprehensive slip disc treatment in Hyderabad: Conservative care, Pain Management, and Minimally Invasive Endoscopic Discectomy. Expert care by Dr. Sayuj…","Slip Disc Treatment in Hyderabad | Comprehensive Care","https://www.drsayuj.info/conditions/slip-disc-treatment-hyderabad/","index, follow",1503
/conditions/spinal-stenosis-treatment-hyderabad,200,"Spinal Stenosis Treatment in Hyderabad | Walking Pain Relief","Can&#x27;t walk more than 10 mins? Expert Lumbar Canal Stenosis treatment in Hyderabad. Micro-Decompression surgery for leg pain &amp; heaviness. Dr Sayuj.","Lumbar Canal Stenosis Treatment in Hyderabad","https://www.drsayuj.info/conditions/spinal-stenosis-treatment-hyderabad/","index, follow",1121
/conditions/spine-tumor-surgery-hyderabad,200,"Spine Tumor Surgery Hyderabad | Dr. Sayuj Krishnan","Specialized surgical treatment for spinal cord tumours and metastatic spine cancer. Microsurgery and spinal stabilisation by Dr. Sayuj Krishnan at Yashoda Hospital.","Spine Tumor Surgery in Hyderabad","https://www.drsayuj.info/conditions/spine-tumor-surgery-hyderabad","index, follow",1197
/conditions/spondylolisthesis-treatment-hyderabad,200,"Spondylolisthesis Treatment in Hyderabad | Slipped Vertebra…","Expert treatment for Spondylolisthesis (Slipped Vertebra) by Dr. Sayuj Krishnan. Minimally invasive fusion (MIS-TLIF) costs and recovery in Hyderabad.","Spondylolisthesis Treatment in Hyderabad","https://www.drsayuj.info/conditions/spondylolisthesis-treatment-hyderabad/","index, follow",1251
/conditions/trigeminal-neuralgia-treatment-hyderabad,200,"Trigeminal Neuralgia Treatment Hyderabad | Immediate Pain Relief","Expert Trigeminal Neuralgia treatment in Hyderabad. MVD surgery &amp; Radiofrequency ablation for facial pain relief by Dr. Sayuj. Proven results. Book now.","Trigeminal Neuralgia Treatment in Hyderabad","https://www.drsayuj.info/conditions/trigeminal-neuralgia-treatment-hyderabad","index, follow",1255
/contact,200,"Contact Dr Sayuj Krishnan | Neurosurgeon in Hyderabad","Contact Dr Sayuj Krishnan for neurosurgical consultations. Phone: +91 9778280044, Email: hellodr@drsayuj.info. Located at Yashoda Hospital, Malakpet.","Contact Dr Sayuj Krishnan","https://www.drsayuj.info/contact","index, follow",770
/content-integrity,200,"Content Integrity &amp; Editorial Process | Dr. Sayuj Krishnan","Learn about our rigorous editorial process, medical review standards, and commitment to accurate, evidence-based neurosurgical content.","Content Integrity &amp; Editorial Process","https://www.drsayuj.info/content-integrity","index, follow",975
/cookies,200,"Cookie Policy | Dr Sayuj Krishnan - Neurosurgeon in Hyderabad","Cookie policy for Dr Sayuj Krishnan&#x27;s neurosurgical practice website. Learn about how we use cookies and similar technologies.","Cookie Policy","https://www.drsayuj.info/cookies","index, follow",578
/disclaimer,200,"Medical Disclaimer | Dr Sayuj Krishnan - Neurosurgeon in Hyderabad","Medical disclaimer for Dr Sayuj Krishnan&#x27;s neurosurgical practice in Hyderabad. Important information about medical advice and treatment.","Medical Disclaimer","https://www.drsayuj.info/disclaimer","index, follow",743
/editorial-policy,200,"Editorial Policy | Dr Sayuj Krishnan","Editorial policy and content standards for medical information provided on Dr Sayuj Krishnan&#x27;s website.","Editorial Policy","https://www.drsayuj.info/editorial-policy","index, follow",729
/knowledge-base,200,"Medical Knowledge Base - Dr. Sayuj Krishnan","Search our comprehensive medical library for information on brain tumors, spine surgery, treatments, and recovery guides.","Medical Knowledge Base","https://www.drsayuj.info/knowledge-base","index, follow",457
/locations,200,"Neurosurgeon Locations in Hyderabad | Dr. Sayuj Krishnan","Expert neurosurgeon Dr. Sayuj Krishnan serves patients across Hyderabad including Banjara Hills, Hitec City, Jubilee Hills, and Malakpet. Book consultation.","Neurosurgeon Locations in Hyderabad","https://www.drsayuj.info/locations","index, follow",781
/locations/banjara-hills,200,"Neurosurgeon in Banjara Hills, Hyderabad | Dr. Sayuj Krishnan","Consult Dr. Sayuj Krishnan near Banjara Hills, Hyderabad for endoscopic spine &amp; minimally invasive brain surgery. OPD timings, parking, directions, WhatsApp booking.","Neurosurgeon in Banjara Hills, Hyderabad","https://www.drsayuj.info/neurosurgeon-banjara-hills","index, follow",579
/locations/brain-spine-surgeon-banjara-hills,200,"Brain &amp; Spine Surgeon near Banjara Hills, Hyderabad","Advanced brain and spine care near Banjara Hills, Hyderabad. Directions to Yashoda Hospital, Malakpet. Parking, timings, and appointment info.","Brain &amp; Spine Surgeon near Banjara Hills, Hyderabad","https://www.drsayuj.info/locations/brain-spine-surgeon-banjara-hills","index, follow",852
/locations/brain-spine-surgeon-hitec-city,200,"Brain &amp; Spine Surgeon near HITEC City, Hyderabad","Neurosurgeon near HITEC City at Yashoda Hospital, Malakpet. Directions, parking, OPD timings, and appointments.","Brain &amp; Spine Surgeon near HITEC City, Hyderabad","https://www.drsayuj.info/locations/brain-spine-surgeon-hitec-city","index, follow",802
/locations/brain-spine-surgeon-jubilee-hills,200,"Brain &amp; Spine Surgeon near Jubilee Hills, Hyderabad","Advanced brain and spine care near Jubilee Hills, Hyderabad. Directions to Yashoda Hospital, Malakpet. Parking, timings, and appointment info.","Brain &amp; Spine Surgeon near Jubilee Hills, Hyderabad","https://www.drsayuj.info/neurosurgeon-jubilee-hills","index, follow",818
/locations/hitech-city,200,"Neurosurgeon in Hitech City, Hyderabad | Dr. Sayuj Krishnan","Consult Dr. Sayuj Krishnan near Hitech City, Hyderabad for endoscopic spine &amp; minimally invasive brain surgery. OPD timings, parking, directions.","Neurosurgeon in Hitech City, Hyderabad","https://www.drsayuj.info/neurosurgeon-hitech-city","index, follow",562
/locations/lb-nagar,200,"Best Neurosurgeon near LB Nagar | 10 Min Drive | Dr. Sayuj","Expert Neurosurgeon for LB Nagar &amp; Vanasthalipuram. Dr. Sayuj offers Endoscopic Spine Surgery, Brain Tumor care &amp; Trauma services at Yashoda Malakpet (10 mins away).","Best Neurosurgeon near LB Nagar, Hyderabad","https://www.drsayuj.info/locations/lb-nagar","index, follow",874
/locations/malakpet,200,"Best Neurosurgeon in Malakpet | Dr. Sayuj Krishnan | Yashoda Hospitals","Dr. Sayuj Krishnan is the leading Neurosurgeon at Yashoda Hospitals, Malakpet. Specialist in Endoscopic Spine Surgery, Brain Tumors &amp; Trauma. Book Appointment.","Best Neurosurgeon in Malakpet, Hyderabad","https://www.drsayuj.info/neurosurgeon-malakpet","index, follow",883
/locations/neurosurgeon-kondapur,200,"Neurosurgeon near Kondapur, Hyderabad | Dr Sayuj Krishnan","Expert neurosurgeon near Kondapur. Dr Sayuj Krishnan provides advanced brain and spine surgery. Convenient access via Hitech City road.","Neurosurgeon Near Kondapur, Hyderabad","https://www.drsayuj.info/locations/neurosurgeon-kondapur","index, follow",576
/locations/neurosurgeon-kothapet,200,"Neurosurgeon near Kothapet, Hyderabad | Dr Sayuj Krishnan","Expert neurosurgeon near Kothapet. Dr Sayuj Krishnan is just 5 minutes away at Yashoda Malakpet. Advanced spine &amp; brain care.","Best Neurosurgeon Near Kothapet &amp; Dilsukhnagar","https://www.drsayuj.info/locations/neurosurgeon-kothapet","index, follow",658
/locations/neurosurgeon-kukatpally,200,"Neurosurgeon near Kukatpally, Hyderabad | Dr Sayuj Krishnan","Expert neurosurgeon near Kukatpally. Dr Sayuj Krishnan provides advanced brain and spine surgery. Convenient access via Metro or road.","Neurosurgeon Near Kukatpally, Hyderabad","https://www.drsayuj.info/locations/neurosurgeon-kukatpally","index, follow",554
/locations/neurosurgeon-madhapur,200,"Neurosurgeon near Madhapur, Hyderabad | Dr Sayuj Krishnan","Expert neurosurgeon near Madhapur. Dr Sayuj Krishnan provides advanced brain and spine surgery. Convenient access via Durgam Cheruvu Cable Bridge.","Neurosurgeon Near Madhapur, Hyderabad","https://www.drsayuj.info/locations/neurosurgeon-madhapur","index, follow",581
/locations/neurosurgeon-manikonda,200,"Neurosurgeon near Manikonda, Hyderabad | Dr Sayuj Krishnan","Expert neurosurgeon near Manikonda. Dr Sayuj Krishnan provides advanced brain and spine surgery with minimally invasive techniques. Easy access via ORR.","Neurosurgeon Near Manikonda, Hyderabad","https://www.drsayuj.info/locations/neurosurgeon-manikonda","index, follow",551
/locations/neurosurgeon-near-jubilee-hills-faq,200,"Neurosurgeon Near Jubilee Hills FAQ | Dr. Sayuj Krishnan","Frequently asked questions about finding a neurosurgeon near Jubilee Hills, Hyderabad. Expert answers from Dr. Sayuj Krishnan about brain and spine surgery options.","Neurosurgeon Near Jubilee Hills FAQ | Dr. Sayuj Krishnan","https://www.drsayuj.info/locations/neurosurgeon-near-jubilee-hills-faq","index, follow",1057
/locations/neurosurgeon-near-kachiguda-faq,200,"Neurosurgeon Near Kachiguda FAQ | Dr. Sayuj Krishnan","Frequently asked questions about finding a neurosurgeon near Kachiguda, Hyderabad. Expert answers from Dr. Sayuj Krishnan about brain and spine surgery options.","Neurosurgeon Near Kachiguda FAQ | Dr. Sayuj Krishnan","https://www.drsayuj.info/locations/neurosurgeon-near-kachiguda-faq","index, follow",947
/locations/neurosurgeon-near-kondapur-faq,200,"Neurosurgeon Near Kondapur FAQ | Dr. Sayuj Krishnan","Frequently asked questions about finding a neurosurgeon near Kondapur, Hyderabad. Expert answers from Dr. Sayuj Krishnan about brain and spine surgery options.","Neurosurgeon Near Kondapur FAQ | Dr. Sayuj Krishnan","https://www.drsayuj.info/locations/neurosurgeon-near-kondapur-faq","index, follow",956
/locations/neurosurgeon-nizampet,200,"Neurosurgeon near Nizampet, Hyderabad | Dr Sayuj Krishnan","Expert neurosurgeon near Nizampet. Dr Sayuj Krishnan provides advanced brain and spine surgery with minimally invasive techniques.","Neurosurgeon Near Nizampet, Hyderabad","https://www.drsayuj.info/locations/neurosurgeon-nizampet","index, follow",555
