URL,Status,Title,Meta Description,H1,Word Count,Canonical,Robots,Schema Types
https://www.drsayuj.info/blog/failed-back-surgery-syndrome-treatment-hyderabad,200,Failed Back Surgery Syndrome: Why Pain Persists & Treatment…,Expert guide to Failed Back Surgery Syndrome (FBSS) in Hyderabad. Learn causes of recurrent pain and explore revision options like endoscopic spine surger…,Failed Back Surgery Syndrome: Why Pain Persists & Treatment Options,1587,https://www.drsayuj.info/blog/failed-back-surgery-syndrome-treatment-hyderabad,"index, follow",BlogPosting;Place;FAQPage;CollegeOrUniversity;OpeningHoursSpecification;AggregateRating;MedicalSpecialty;State;BreadcrumbList;Hospital;ReserveAction;Offer;MedicalWebPage;WebSite;MedicalService;Physician;PropertyValue;Question;GeoCoordinates;Organization;City;Answer;PostalAddress;OfferCatalog;ListItem;EducationalOccupationalCredential;MedicalProcedure;Person;Country
https://www.drsayuj.info/services/epilepsy-surgery-hyderabad,200,Epilepsy Surgery in Hyderabad | Drug-Resistant Epilepsy Tre…,"Expert epilepsy surgery for drug-resistant epilepsy in Hyderabad. LITT, resection surgery, VNS. Comprehensive evaluation and advanced techniques.",Epilepsy Surgery in Hyderabad,1110,https://www.drsayuj.info/services/epilepsy-surgery-hyderabad,"index, follow",Place;CollegeOrUniversity;OpeningHoursSpecification;AggregateRating;MedicalSpecialty;State;Hospital;ReserveAction;Offer;WebSite;MedicalService;Physician;PropertyValue;GeoCoordinates;Organization;City;PostalAddress;OfferCatalog;EducationalOccupationalCredential;MedicalProcedure;Country
https://www.drsayuj.info/conditions/sciatica-pain-treatment-hyderabad,200,Sciatica Treatment Hyderabad: Non-Surgical Cure & Dr Sayuj,Sciatica Treatment Hyderabad: 90% non-surgical recovery with nerve blocks. Endoscopic cure for severe cases by Dr. Sayuj. Book Consult.,Sciatica Treatment in Hyderabad;Non-Surgical Relief First,2197,https://www.drsayuj.info/conditions/sciatica-pain-treatment-hyderabad,"index, follow",Place;FAQPage;MedicalCondition;CollegeOrUniversity;OpeningHoursSpecification;AggregateRating;MedicalSpecialty;State;Hospital;ReserveAction;Offer;MedicalWebPage;WebSite;MedicalSymptom;MedicalAudience;MedicalService;Physician;PropertyValue;Question;GeoCoordinates;Organization;City;Answer;PostalAddress;OfferCatalog;EducationalOccupationalCredential;MedicalRiskFactor;MedicalProcedure;Person;Country;MedicalTherapy
https://www.drsayuj.info/services/cooled-radiofrequency-ablation-hyderabad,200,Cooled Radiofrequency Ablation Hyderabad | Pain Relief,"Advanced cooled radiofrequency ablation for chronic pain relief in Hyderabad. Long-lasting nerve ablation for facet joints, sacroiliac joints, and trigemi…",Cooled Radiofrequency Ablation in Hyderabad,1585,https://www.drsayuj.info/services/cooled-radiofrequency-ablation-hyderabad,"index, follow",Place;FAQPage;CollegeOrUniversity;OpeningHoursSpecification;AggregateRating;MedicalSpecialty;State;BreadcrumbList;Hospital;ReserveAction;Offer;WebSite;MedicalService;Physician;PropertyValue;Question;GeoCoordinates;Organization;City;Answer;PostalAddress;OfferCatalog;ListItem;EducationalOccupationalCredential;MedicalProcedure;Country
https://www.drsayuj.info/content-integrity,200,Content Integrity & Editorial Process | Dr. Sayuj Krishnan,"Learn about our rigorous editorial process, medical review standards, and commitment to accurate, evidence-based neurosurgical content.",Content Integrity & Editorial Process,973,https://www.drsayuj.info/content-integrity,"index, follow",Place;CollegeOrUniversity;OpeningHoursSpecification;AggregateRating;MedicalSpecialty;State;BreadcrumbList;Hospital;ReserveAction;Offer;WebSite;MedicalService;Physician;PropertyValue;GeoCoordinates;Organization;City;PostalAddress;OfferCatalog;ListItem;EducationalOccupationalCredential;MedicalProcedure;Country
https://www.drsayuj.info/neurosurgeon-hitech-city,200,Neurosurgeon in Hitech City | Endoscopic Spine | Dr. Sayuj,"Consult Dr. Sayuj Krishnan near Hitech City, Hyderabad for endoscopic spine & minimally invasive brain surgery. OPD timings, parking, directions, WhatsApp booking, and FAQs.","Neurosurgeon in Hitech City, Hyderabad",653,https://www.drsayuj.info/neurosurgeon-hitech-city,"index, follow",Place;FAQPage;CollegeOrUniversity;OpeningHoursSpecification;AggregateRating;MedicalSpecialty;State;BreadcrumbList;Hospital;ReserveAction;Offer;WebSite;MedicalService;Physician;PropertyValue;Question;GeoCoordinates;Organization;City;Answer;PostalAddress;MedicalClinic;OfferCatalog;ListItem;EducationalOccupationalCredential;MedicalProcedure;Country
https://www.drsayuj.info/conditions/carpal-tunnel-syndrome-hyderabad,200,Carpal Tunnel Syndrome Treatment in Hyderabad | Dr. Sayuj K…,Day-care minimally invasive decompression for wrist nerve compression with rapid functional recovery.,Carpal Tunnel Syndrome,586,https://www.drsayuj.info/conditions/carpal-tunnel-syndrome-hyderabad,"index, follow",Place;FAQPage;MedicalCondition;CollegeOrUniversity;OpeningHoursSpecification;AggregateRating;MedicalSpecialty;State;BreadcrumbList;Hospital;ReserveAction;Offer;WebSite;MedicalService;Physician;PropertyValue;Question;GeoCoordinates;Organization;City;Answer;PostalAddress;OfferCatalog;ListItem;EducationalOccupationalCredential;MedicalProcedure;Country;MedicalTherapy;MedicalSignOrSymptom
https://www.drsayuj.info/blog/cervical-spondylosis-neck-pain-hyderabad,200,Neck Pain or Cervical Spondylosis? A Guide for Hyderabad's…,"Neck pain in Hyderabad? Learn tech neck vs cervical spondylosis, key symptoms, and when to see a spine specialist.",Neck Pain or Cervical Spondylosis? A Guide for Hyderabad's Tech Professionals,1980,https://www.drsayuj.info/blog/cervical-spondylosis-neck-pain-hyderabad,"index, follow",Place;FAQPage;CollegeOrUniversity;OpeningHoursSpecification;AggregateRating;MedicalSpecialty;State;BreadcrumbList;Hospital;ReserveAction;Offer;MedicalWebPage;WebSite;MedicalService;Physician;PropertyValue;Question;GeoCoordinates;Organization;City;Answer;PostalAddress;OfferCatalog;ListItem;EducationalOccupationalCredential;MedicalProcedure;Person;Country
https://www.drsayuj.info/blog/lumbar-spondylosis-treatment-exercises-hyderabad,200,Lumbar Spondylosis Treatment & Exercises: A Guide for Hyder…,"Comprehensive guide to Lumbar Spondylosis treatment in Hyderabad. Discover exercises, physiotherapy options, and when to see a spine specialist.",Lumbar Spondylosis Treatment & Exercises: A Guide for Hyderabad Patients,1108,https://www.drsayuj.info/blog/lumbar-spondylosis-treatment-exercises-hyderabad,"index, follow",Place;FAQPage;CollegeOrUniversity;OpeningHoursSpecification;AggregateRating;MedicalSpecialty;State;BreadcrumbList;Hospital;ReserveAction;Offer;MedicalWebPage;WebSite;MedicalService;Physician;PropertyValue;Question;GeoCoordinates;Organization;City;Answer;PostalAddress;OfferCatalog;ListItem;EducationalOccupationalCredential;MedicalProcedure;Person;Country
https://www.drsayuj.info/services/spinal-fusion-surgery-hyderabad,200,Spinal Fusion & Fracture Surgery Hyderabad | Best TLIF Surg…,Expert Spinal Fusion & Fracture Surgery in Hyderabad. Minimally Invasive TLIF for Spondylolisthesis and Trauma Fixation by Dr. Sayuj Krishnan.,Spinal Fusion Surgery (TLIF/PLIF),1358,https://www.drsayuj.info/services/spinal-fusion-surgery-hyderabad,"index, follow",Place;FAQPage;CollegeOrUniversity;OpeningHoursSpecification;AggregateRating;MedicalSpecialty;State;Hospital;ReserveAction;Offer;MedicalWebPage;WebSite;MedicalAudience;MedicalService;Physician;PropertyValue;Question;GeoCoordinates;Organization;City;Answer;PostalAddress;OfferCatalog;EducationalOccupationalCredential;MedicalProcedure;Person;Country
https://www.drsayuj.info/services/minimally-invasive-spine-surgery,200,Minimally Invasive Spine Surgery Hyderabad | Best Spine Sur…,Looking for Minimally Invasive Spine Surgery? Dr. Sayuj specializes in Day-Care Endoscopic Spine Surgery with same-day discharge. 1000+ Success Stories.,Endoscopic & Minimally Invasive Spine Surgery Hyderabad,2547,https://www.drsayuj.info/services/minimally-invasive-spine-surgery,"index, follow",Place;FAQPage;CollegeOrUniversity;OpeningHoursSpecification;AggregateRating;MedicalSpecialty;State;BreadcrumbList;Hospital;ReserveAction;Offer;MedicalWebPage;WebSite;MedicalAudience;MedicalService;Physician;PropertyValue;Question;GeoCoordinates;Organization;City;Answer;PostalAddress;OfferCatalog;ListItem;EducationalOccupationalCredential;MedicalProcedure;Person;Country
https://www.drsayuj.info/blog/spondylolisthesis-treatment-guide-hyderabad,200,"Spondylolisthesis Treatment Guide: Exercises, Bracing, and…","A complete guide to treating Spondylolisthesis (slipped vertebra) in Hyderabad. Learn when exercises work, bracing helps, or fusion surgery is needed.","Spondylolisthesis Treatment Guide: Exercises, Bracing, and Surgery",2011,https://www.drsayuj.info/blog/spondylolisthesis-treatment-guide-hyderabad,"index, follow",Place;FAQPage;CollegeOrUniversity;OpeningHoursSpecification;AggregateRating;MedicalSpecialty;State;BreadcrumbList;Hospital;ReserveAction;Offer;MedicalWebPage;WebSite;MedicalService;Physician;PropertyValue;Question;GeoCoordinates;Organization;City;Answer;PostalAddress;OfferCatalog;ListItem;EducationalOccupationalCredential;MedicalProcedure;Person;Country
https://www.drsayuj.info/blog/life-after-spinal-fusion-surgery-recovery-hyderabad,200,Life After Spinal Fusion Surgery: Recovery and Mobility Tru…,"Discover life after spinal fusion surgery in Hyderabad. Learn about recovery timelines, mobility myths, and when you can drive or return to work.",Life After Spinal Fusion Surgery: Recovery and Mobility Truths in Hyderabad,1419,https://www.drsayuj.info/blog/life-after-spinal-fusion-surgery-recovery-hyderabad,"index, follow",Place;FAQPage;CollegeOrUniversity;OpeningHoursSpecification;AggregateRating;MedicalSpecialty;State;BreadcrumbList;Hospital;ReserveAction;Offer;MedicalWebPage;WebSite;MedicalService;Physician;PropertyValue;Question;GeoCoordinates;Organization;City;Answer;PostalAddress;OfferCatalog;ListItem;EducationalOccupationalCredential;MedicalProcedure;Person;Country
https://www.drsayuj.info/blog/sciatica-exercises-for-office-workers-hyderabad,200,5 Sciatica Exercises for Office Workers in Hyderabad | Dr.…,Best sciatica exercises for software engineers and office workers in Hyderabad. Learn how to prevent back pain from long sitting hours with Dr. Sayuj Kris…,5 Sciatica Exercises for Office Workers in Hyderabad,1178,https://www.drsayuj.info/blog/sciatica-exercises-for-office-workers-hyderabad,"index, follow",Place;FAQPage;CollegeOrUniversity;OpeningHoursSpecification;AggregateRating;MedicalSpecialty;State;BreadcrumbList;Hospital;ReserveAction;Offer;MedicalWebPage;WebSite;MedicalService;Physician;PropertyValue;Question;GeoCoordinates;Organization;City;Answer;PostalAddress;OfferCatalog;ListItem;EducationalOccupationalCredential;MedicalProcedure;Person;Country
https://www.drsayuj.info/blog/carpal-tunnel-vs-cervical-radiculopathy-hyderabad,200,Carpal Tunnel vs. Cervical Radiculopathy: Why is My Hand Nu…,"Confused between Carpal Tunnel and Cervical Radiculopathy? Discover key differences, symptoms, and treatments for hand numbness in this Hyderabad guide.",Carpal Tunnel vs. Cervical Radiculopathy: Why is My Hand Numb? (Hyderabad Guide),1274,https://www.drsayuj.info/blog/carpal-tunnel-vs-cervical-radiculopathy-hyderabad,"index, follow",Place;FAQPage;CollegeOrUniversity;OpeningHoursSpecification;AggregateRating;MedicalSpecialty;State;BreadcrumbList;Hospital;ReserveAction;Offer;MedicalWebPage;WebSite;MedicalService;Physician;PropertyValue;Question;GeoCoordinates;Organization;City;Answer;PostalAddress;OfferCatalog;ListItem;EducationalOccupationalCredential;MedicalProcedure;Person;Country
https://www.drsayuj.info/neurosurgeon-gachibowli,200,"Neurosurgeon in Gachibowli, Hyderabad | Endoscopic Spine | Dr. Sayuj Krishnan","Consult Dr. Sayuj Krishnan near Gachibowli, Hyderabad for endoscopic spine & minimally invasive brain surgery. OPD timings, parking, directions, WhatsApp booking, and FAQs.","Neurosurgeon in Gachibowli, Hyderabad",550,https://www.drsayuj.info/neurosurgeon-gachibowli,"index, follow",Place;FAQPage;CollegeOrUniversity;OpeningHoursSpecification;AggregateRating;MedicalSpecialty;State;BreadcrumbList;Hospital;ReserveAction;Offer;WebSite;MedicalService;Physician;PropertyValue;Question;GeoCoordinates;Organization;City;Answer;PostalAddress;MedicalClinic;OfferCatalog;ListItem;EducationalOccupationalCredential;MedicalProcedure;Country
https://www.drsayuj.info/brain-surgery,200,Brain Surgery Hyderabad | Awake Tumor Surgery | Dr Sayuj,"Expert brain surgery in Hyderabad with Dr. Sayuj Krishnan. Specializing in awake brain surgery, brain tumors, ROSA DBS, and neuronavigation.",Advanced Brain Surgery,1261,https://www.drsayuj.info/brain-surgery,"index, follow",Place;FAQPage;CollegeOrUniversity;OpeningHoursSpecification;AggregateRating;MedicalSpecialty;State;BreadcrumbList;Hospital;ReserveAction;Offer;MedicalWebPage;WebSite;MedicalAudience;MedicalService;Physician;PropertyValue;Question;GeoCoordinates;Organization;City;Answer;PostalAddress;OfferCatalog;ListItem;EducationalOccupationalCredential;MedicalProcedure;Person;Country
https://www.drsayuj.info/blog/cervical-myelopathy-symptoms-warning-signs-hyderabad,200,Clumsy Hands & Balance Issues? Identifying Cervical Myelopa…,Learn the warning signs of Cervical Myelopathy (Spinal Cord Compression). Understand why clumsy hands and balance issues require urgent neurosurgical atte…,Clumsy Hands & Balance Issues? Identifying Cervical Myelopathy Symptoms,1836,https://www.drsayuj.info/blog/cervical-myelopathy-symptoms-warning-signs-hyderabad,"index, follow",Place;FAQPage;CollegeOrUniversity;OpeningHoursSpecification;AggregateRating;MedicalSpecialty;State;BreadcrumbList;Hospital;ReserveAction;Offer;MedicalWebPage;WebSite;MedicalService;Physician;PropertyValue;Question;GeoCoordinates;Organization;City;Answer;PostalAddress;OfferCatalog;ListItem;EducationalOccupationalCredential;MedicalProcedure;Person;Country
https://www.drsayuj.info/locations/neurosurgeon-madhapur,200,"Neurosurgeon near Madhapur, Hyderabad | Dr Sayuj Krishnan",Expert neurosurgeon near Madhapur. Dr Sayuj Krishnan provides advanced brain and spine surgery. Convenient access via Durgam Cheruvu Cable Bridge.,"Neurosurgeon Near Madhapur, Hyderabad",580,https://www.drsayuj.info/locations/neurosurgeon-madhapur,"index, follow",Place;FAQPage;CollegeOrUniversity;OpeningHoursSpecification;AggregateRating;MedicalSpecialty;State;BreadcrumbList;Hospital;ReserveAction;Offer;WebSite;MedicalService;Physician;PropertyValue;Question;GeoCoordinates;Organization;City;Answer;PostalAddress;MedicalClinic;OfferCatalog;ListItem;EducationalOccupationalCredential;MedicalProcedure;Country
https://www.drsayuj.info/conditions/scoliosis-treatment-hyderabad,200,Scoliosis Treatment in Hyderabad | Spine Curvature Correcti…,Expert treatment for Scoliosis (Spine Deformity) by Dr. Sayuj Krishnan. Minimally invasive correction surgery costs and recovery in Hyderabad.,Scoliosis Treatment in Hyderabad,1182,https://www.drsayuj.info/conditions/scoliosis-treatment-hyderabad/,"index, follow",Place;FAQPage;MedicalCondition;CollegeOrUniversity;OpeningHoursSpecification;AggregateRating;MedicalSpecialty;State;Hospital;ReserveAction;Offer;AnatomicalStructure;WebSite;MedicalService;Physician;PropertyValue;Question;GeoCoordinates;Organization;City;Answer;PostalAddress;OfferCatalog;EducationalOccupationalCredential;MedicalProcedure;Country;MedicalTherapy
https://www.drsayuj.info/terms,200,Terms of Service | Dr Sayuj Krishnan - Neurosurgeon in Hyderabad,Terms of service for Dr Sayuj Krishnan's neurosurgical practice in Hyderabad. Read our terms and conditions for using our website and services.,Terms of Service,859,https://www.drsayuj.info/terms,"index, follow",Place;CollegeOrUniversity;OpeningHoursSpecification;AggregateRating;MedicalSpecialty;State;BreadcrumbList;Hospital;ReserveAction;Offer;WebSite;MedicalService;Physician;PropertyValue;GeoCoordinates;Organization;City;PostalAddress;OfferCatalog;ListItem;EducationalOccupationalCredential;MedicalProcedure;Country
https://www.drsayuj.info/blog/l4-l5-disc-bulge-treatment-hyderabad,200,"L4-L5 Disc Bulge: Symptoms, Risks, and Treatment Options in…","L4-L5 disc bulge guide by Dr. Sayuj Krishnan. Learn about symptoms like sciatica, foot drop red flags, and non-surgical treatments in Hyderabad.","L4-L5 Disc Bulge: Symptoms, Risks, and Treatment Options in Hyderabad",1343,https://www.drsayuj.info/blog/l4-l5-disc-bulge-treatment-hyderabad,"index, follow",Place;FAQPage;CollegeOrUniversity;OpeningHoursSpecification;AggregateRating;MedicalSpecialty;State;BreadcrumbList;Hospital;ReserveAction;Offer;MedicalWebPage;WebSite;MedicalService;Physician;PropertyValue;Question;GeoCoordinates;Organization;City;Answer;PostalAddress;OfferCatalog;ListItem;EducationalOccupationalCredential;MedicalProcedure;Person;Country
https://www.drsayuj.info/services/awake-spine-surgery-hyderabad,200,Awake Spine Surgery Hyderabad,"Awake endoscopic spine surgery for high-risk patients. Local anesthesia, no general anesthesia needed. Faster recovery & same-day discharge in Hyderabad.",Awake Spine Surgery in Hyderabad,897,https://www.drsayuj.info/services/awake-spine-surgery-hyderabad,"index, follow",Place;FAQPage;CollegeOrUniversity;OpeningHoursSpecification;AggregateRating;MedicalSpecialty;State;BreadcrumbList;Hospital;ReserveAction;Offer;MedicalWebPage;WebSite;MedicalAudience;MedicalService;Physician;PropertyValue;Question;GeoCoordinates;Organization;City;Answer;PostalAddress;OfferCatalog;ListItem;EducationalOccupationalCredential;MedicalProcedure;Person;Country
https://www.drsayuj.info/conditions/spinal-stenosis-treatment-hyderabad,200,Spinal Stenosis Treatment Hyderabad | Walking Pain Relief,Can't walk more than 10 mins? Expert Lumbar Canal Stenosis treatment in Hyderabad. Micro-Decompression surgery for leg pain & heaviness. Dr Sayuj.,Lumbar Canal Stenosis Treatment in Hyderabad,1247,https://www.drsayuj.info/conditions/spinal-stenosis-treatment-hyderabad,"index, follow",Place;FAQPage;MedicalCondition;CollegeOrUniversity;OpeningHoursSpecification;AggregateRating;MedicalSpecialty;State;Hospital;ReserveAction;Offer;AnatomicalStructure;WebSite;MedicalService;Physician;PropertyValue;Question;GeoCoordinates;Organization;City;Answer;PostalAddress;OfferCatalog;EducationalOccupationalCredential;MedicalProcedure;Country;MedicalTherapy
https://www.drsayuj.info/blog/types-of-spine-tumors-symptoms-guide,200,Types of Spine Tumors: Benign vs. Cancerous & Warning Signs…,"Dr. Sayuj Krishnan explains spinal tumors: types (benign vs. cancerous), red flag symptoms, and treatment options available in Hyderabad.",Types of Spine Tumors: Benign vs. Cancerous & Warning Signs,1515,https://www.drsayuj.info/blog/types-of-spine-tumors-symptoms-guide,"index, follow",Place;FAQPage;CollegeOrUniversity;OpeningHoursSpecification;AggregateRating;MedicalSpecialty;State;BreadcrumbList;Hospital;ReserveAction;Offer;MedicalWebPage;WebSite;MedicalService;Physician;PropertyValue;Question;GeoCoordinates;Organization;City;Answer;PostalAddress;OfferCatalog;ListItem;EducationalOccupationalCredential;MedicalProcedure;Person;Country
https://www.drsayuj.info/locations/neurosurgeon-kothapet,200,"Neurosurgeon near Kothapet, Hyderabad | Dr Sayuj Krishnan",Expert neurosurgeon near Kothapet. Dr Sayuj Krishnan is just 5 minutes away at Yashoda Malakpet. Advanced spine & brain care.,Best Neurosurgeon Near Kothapet & Dilsukhnagar,655,https://www.drsayuj.info/locations/neurosurgeon-kothapet,"index, follow",Place;FAQPage;CollegeOrUniversity;OpeningHoursSpecification;AggregateRating;MedicalSpecialty;State;BreadcrumbList;Hospital;ReserveAction;Offer;WebSite;MedicalService;Physician;PropertyValue;Question;GeoCoordinates;Organization;City;Answer;PostalAddress;MedicalClinic;OfferCatalog;ListItem;EducationalOccupationalCredential;MedicalProcedure;Country
https://www.drsayuj.info/conditions/spondylolisthesis-treatment-hyderabad,200,Spondylolisthesis Treatment Hyderabad | Slipped Vertebra,Best Spondylolisthesis Treatment in Hyderabad. Minimally Invasive Fusion (MIS-TLIF) for Slipped Vertebra by Dr. Sayuj. Check Surgery Cost & Recovery.,Spondylolisthesis Treatment in Hyderabad,1252,https://www.drsayuj.info/conditions/spondylolisthesis-treatment-hyderabad/,"index, follow",Place;FAQPage;MedicalCondition;CollegeOrUniversity;OpeningHoursSpecification;AggregateRating;MedicalSpecialty;State;Hospital;ReserveAction;Offer;AnatomicalStructure;WebSite;MedicalService;Physician;PropertyValue;Question;GeoCoordinates;Organization;City;Answer;PostalAddress;OfferCatalog;EducationalOccupationalCredential;MedicalProcedure;Country;MedicalTherapy
https://www.drsayuj.info/blog/endoscopic-pituitary-tumor-surgery-hyderabad,200,Endoscopic Pituitary Tumor Surgery (Through the Nose) in Hy…,"Detailed guide to Endoscopic Transsphenoidal Surgery for Pituitary Adenomas in Hyderabad. No external scars, faster recovery, and high safety standards.",Endoscopic Pituitary Tumor Surgery (Through the Nose) in Hyderabad,1553,https://www.drsayuj.info/blog/endoscopic-pituitary-tumor-surgery-hyderabad,"index, follow",Place;FAQPage;CollegeOrUniversity;OpeningHoursSpecification;AggregateRating;MedicalSpecialty;State;BreadcrumbList;Hospital;ReserveAction;Offer;MedicalWebPage;WebSite;MedicalService;Physician;PropertyValue;Question;GeoCoordinates;Organization;City;Answer;PostalAddress;OfferCatalog;ListItem;EducationalOccupationalCredential;MedicalProcedure;Person;Country
https://www.drsayuj.info/neurosurgeon-hyderabad,200,Best Neurosurgeon Hyderabad | Dr Sayuj | Spine & Brain,"Dr. Sayuj: Best Neurosurgeon in Hyderabad. Endoscopic Spine & Brain Tumor Expert. Same-Day Discharge. 1,000+ Surgeries at Yashoda Hospital Malakpet.",Advanced Brain &;Spine Care,1246,https://www.drsayuj.info/neurosurgeon-hyderabad,"index, follow",Place;FAQPage;CollegeOrUniversity;OpeningHoursSpecification;AggregateRating;MedicalSpecialty;State;BreadcrumbList;Hospital;ReserveAction;Offer;WebSite;MedicalService;Physician;PropertyValue;Question;GeoCoordinates;Organization;City;Answer;PostalAddress;MedicalClinic;OfferCatalog;ListItem;EducationalOccupationalCredential;MedicalProcedure;Country
https://www.drsayuj.info/blog/microdiscectomy-vs-laminectomy-recovery-comparison,200,Microdiscectomy vs. Laminectomy: Recovery & Cost in Hyderab…,"Compare Microdiscectomy vs Laminectomy for Hyderabad patients. Learn about recovery timelines, success rates, and cost estimates for slip disc surgery.",Microdiscectomy vs. Laminectomy: Recovery & Cost in Hyderabad,1131,https://www.drsayuj.info/blog/microdiscectomy-vs-laminectomy-recovery-comparison,"index, follow",Place;CollegeOrUniversity;OpeningHoursSpecification;AggregateRating;MedicalSpecialty;State;BreadcrumbList;Hospital;ReserveAction;Offer;MedicalWebPage;WebSite;MedicalService;Physician;PropertyValue;GeoCoordinates;Organization;City;PostalAddress;OfferCatalog;ListItem;EducationalOccupationalCredential;MedicalProcedure;Person;Country
https://www.drsayuj.info/symptoms/pain-on-top-of-head-causes,200,Vertex Headache Causes | Pain on Top of Head (Hyderabad),"Causes of pain on top of the head (vertex headache), red flags, and when to see a neurosurgeon in Hyderabad.",Pain on Top of the Head — Causes & Next Steps,1143,https://www.drsayuj.info/symptoms/pain-on-top-of-head-causes,"index, follow",Place;FAQPage;MedicalCondition;CollegeOrUniversity;OpeningHoursSpecification;AggregateRating;MedicalSpecialty;State;BreadcrumbList;Hospital;ReserveAction;Offer;MedicalWebPage;WebSite;MedicalService;Physician;PropertyValue;Question;GeoCoordinates;Organization;City;Answer;PostalAddress;MedicalClinic;OfferCatalog;ListItem;EducationalOccupationalCredential;MedicalProcedure;Country
https://www.drsayuj.info/services,200,Neurosurgical Services in Hyderabad | Dr. Sayuj Krishnan,"Expert neurosurgical services including endoscopic spine surgery, brain tumor surgery, epilepsy surgery, and trigeminal neuralgia treatment in Hyderabad.",Neurosurgical Services,1294,https://www.drsayuj.info/services,"index, follow",Place;CollegeOrUniversity;OpeningHoursSpecification;AggregateRating;MedicalSpecialty;State;BreadcrumbList;Hospital;ReserveAction;Offer;MedicalWebPage;WebSite;MedicalAudience;MedicalService;Physician;PropertyValue;GeoCoordinates;Organization;City;PostalAddress;Audience;OfferCatalog;ListItem;EducationalOccupationalCredential;MedicalProcedure;Person;Country
https://www.drsayuj.info/media,200,Media Publications & Expert Articles | Dr. Sayuj Krishnan,"Expert articles, media coverage, and publications by Dr. Sayuj Krishnan on neurosurgery, spine surgery, and minimally invasive techniques in leading healthcare publications.",Media Publications & Expert Articles,858,https://www.drsayuj.info/media,"index, follow",Place;WatchAction;ImageObject;CollegeOrUniversity;OpeningHoursSpecification;AggregateRating;MedicalSpecialty;State;BreadcrumbList;Hospital;ReserveAction;Offer;VideoObject;WebSite;MedicalService;Physician;PropertyValue;GeoCoordinates;Organization;City;PostalAddress;OfferCatalog;ListItem;EducationalOccupationalCredential;MedicalProcedure;Country
